text_a,span_text_a,text_b,span_text_b,normalized_vertical_gap,indentation_change,same_alignment,is_centered_A,is_centered_B,font_size_a,font_size_b,font_size_diff,same_font,is_bold_A,is_bold_B,is_italic_A,is_italic_B,is_monospace_A,is_monospace_B,same_bold,same_italic,same_monospace,line_a_ends_punctuation,line_b_starts_lowercase,is_linea_in_rectangle,is_lineb_in_rectangle,both_in_table,neither_in_table,is_linea_hashed,is_lineb_hashed,both_hashed,neither_hashed,page_number_a,page_number_b,label
any edits. Revert to the original document if any issues arise during the editing process.,any edits. Revert to the original document if any issues arise during the editing process.,Recognize text on scanned PDF,Recognize text on scanned PDF,145.48,0,1,1,0,12,16.02,4.02,0,0,1,0,0,0,0,0,1,1,1,0,0,0,0,1,0,1,0,0,14,14,0
Recognize text on scanned PDF,Recognize text on scanned PDF,"You can use the Scan & OCR tool to recognize text, change OCR language, and make all","You can use the Scan & OCR tool to recognize text, change OCR language, and make all",78.27,0,1,0,1,16.02,12,-4.02,0,1,0,0,0,0,0,0,1,1,0,0,0,0,0,1,1,0,0,0,14,14,0
"You can use the Scan & OCR tool to recognize text, change OCR language, and make all","You can use the Scan & OCR tool to recognize text, change OCR language, and make all",pages editable in one go. To do so:,pages editable in one go. To do so:,0,0,1,1,0,12,12,0,1,0,0,0,0,0,0,1,1,1,0,1,0,0,0,1,0,0,0,1,14,14,1
"1. Open the scanned file, and then from the top banner that appears, select Get","1. Open the scanned file, and then from the top banner that appears, select Get",started .,started.,0,18,0,0,0,12,12,0,0,0,1,0,0,0,0,0,1,1,0,1,0,0,0,1,0,0,0,1,15,15,1
started .,started.,It opens the Scan & OCR tool options in the left panel,It opens the Scan & OCR tool options in the left panel,1.86,0,1,0,1,12,12,0,0,1,0,0,0,0,0,0,1,1,1,0,0,0,0,1,0,0,0,1,15,15,0
It opens the Scan & OCR tool options in the left panel,It opens the Scan & OCR tool options in the left panel,"2. From the left panel, under Recognize text, select In this file .","2. From the left panel, under Recognize text, select In this file.",28.86,-18,0,1,0,12,12,0,1,0,0,0,0,0,0,1,1,1,0,0,0,0,0,1,0,0,0,1,15,15,0
"2. From the left panel, under Recognize text, select In this file .","2. From the left panel, under Recognize text, select In this file.","3. In the dialog that opens, select the pages that you want to apply text","3. In the dialog that opens, select the pages that you want to apply text",0.99,0,1,0,0,12,12,0,1,0,0,0,0,0,0,1,1,1,1,0,0,0,0,1,0,0,0,1,15,15,0
"3. In the dialog that opens, select the pages that you want to apply text","3. In the dialog that opens, select the pages that you want to apply text",recognition for and the language.,recognition for and the language.,0,18,0,0,0,12,12,0,1,0,0,0,0,0,0,1,1,1,0,1,0,0,0,1,0,0,0,1,15,15,1
recognition for and the language.,recognition for and the language.,4. Select Recognize text .,4. Select Recognize text.,1.01,-18,0,0,0,12,12,0,1,0,0,0,0,0,0,1,1,1,1,0,0,0,0,1,0,0,0,1,15,15,0
4. Select Recognize text .,4. Select Recognize text.,Edit a scanned document,Edit a scanned document,3.59,-54,0,0,0,12,16.02,4.02,0,0,1,0,0,0,0,0,1,1,1,0,0,0,0,1,0,1,0,0,15,15,0
Edit a scanned document,Edit a scanned document,1. Open the scanned PDF file in Acrobat.,1. Open the scanned PDF file in Acrobat.,0,18,0,0,0,16.02,12,-4.02,0,1,0,0,0,0,0,0,1,1,0,0,0,0,0,1,1,0,0,0,15,15,0
1. Open the scanned PDF file in Acrobat.,1. Open the scanned PDF file in Acrobat.,"2. From the global bar in the upper left, select Edit .","2. From the global bar in the upper left, select Edit.",1.01,0,1,0,0,12,12,0,1,0,0,0,0,0,0,1,1,1,1,0,0,0,0,1,0,0,0,1,15,15,0
"2. From the global bar in the upper left, select Edit .","2. From the global bar in the upper left, select Edit.",3. Select the text element that you want to edit and start typing. The new text matches,3. Select the text element that you want to edit and start typing. The new text matches,0.99,0,1,0,0,12,12,0,1,0,0,0,0,0,0,1,1,1,1,0,0,0,0,1,0,0,0,1,15,15,0
3. Select the text element that you want to edit and start typing. The new text matches,3. Select the text element that you want to edit and start typing. The new text matches,the original font in your scanned PDF.,the original font in your scanned PDF.,0,18,0,0,0,12,12,0,1,0,0,0,0,0,0,1,1,1,0,1,0,0,0,1,0,0,0,1,15,15,1
the original font in your scanned PDF.,the original font in your scanned PDF.,"4. From the upper-left corner, select the hamburger menu Windows or File","4. From the upper-left corner, select the hamburger menu",1.02,-18,0,0,0,12,12,0,1,0,0,0,0,0,0,1,1,1,1,0,0,0,0,1,0,0,0,1,15,15,0
"4. From the upper-left corner, select the hamburger menu Windows or File","4. From the upper-left corner, select the hamburger menu",macOS> Save as and enter a new name for your document.,(macOS)> Save as and enter a new name for your document.,0.02,18,0,0,0,12,12,0,1,0,0,0,0,0,0,1,1,1,0,1,0,0,0,1,0,0,0,1,15,15,1
macOS> Save as and enter a new name for your document.,(macOS)> Save as and enter a new name for your document.,"Initially, the language is set to the default locale, and the other options are disabled. Any","Initially, the language is set to the default locale, and the other options are disabled. Any",0.99,-36,0,0,1,12,12,0,1,0,0,0,0,0,0,1,1,1,1,0,0,0,0,1,0,0,0,1,15,15,0
"Initially, the language is set to the default locale, and the other options are disabled. Any","Initially, the language is set to the default locale, and the other options are disabled. Any",changes to these settings are persisted and are applied when you edit the document.,changes to these settings are persisted and are applied when you edit the document.,0,0,1,1,1,12,12,0,1,0,0,0,0,0,0,1,1,1,0,1,0,0,0,1,0,0,0,1,15,15,1
Enhance scanned file or camera images for clear PDFs,Enhance scanned file or camera images for,You can capture document photos with your smartphone and use the Enhance camera,You can capture document photos with your smartphone and use the Enhance camera,4.99,0,1,1,0,24,12,-12,0,1,0,0,0,0,0,0,1,1,0,0,0,0,0,1,1,0,0,0,16,16,0
You can capture document photos with your smartphone and use the Enhance camera,You can capture document photos with your smartphone and use the Enhance camera,"image feature to create polished, clear, and compact PDFs without needing a standard","image feature to create polished, clear, and compact PDFs without needing a standard",0,0,1,0,0,12,12,0,0,0,1,0,0,0,0,0,1,1,0,1,0,0,0,1,0,0,0,1,16,16,1
"image feature to create polished, clear, and compact PDFs without needing a standard","image feature to create polished, clear, and compact PDFs without needing a standard","scanner. This feature addresses common issues in mobile-captured images, such as incorrect","scanner. This feature addresses common issues in mobile-captured images, such as incorrect",0.01,0,1,0,1,12,12,0,0,1,0,0,0,0,0,0,1,1,0,1,0,0,0,1,0,0,0,1,16,16,1
"scanner. This feature addresses common issues in mobile-captured images, such as incorrect","scanner. This feature addresses common issues in mobile-captured images, such as incorrect","perspectives, areas beyond boundaries, shadows, and inconsistent lighting. While it may not","perspectives, areas beyond boundaries, shadows, and inconsistent lighting. While it may not",0,0,1,1,1,12,12,0,1,0,0,0,0,0,0,1,1,1,0,1,0,0,0,1,0,0,0,1,16,16,1
"perspectives, areas beyond boundaries, shadows, and inconsistent lighting. While it may not","perspectives, areas beyond boundaries, shadows, and inconsistent lighting. While it may not","eliminate all problems, it significantly improves the overall quality of your resulting PDF.","eliminate all problems, it significantly improves the overall quality of your resulting PDF.",0,0,1,1,1,12,12,0,1,0,0,0,0,0,0,1,1,1,0,1,0,0,0,1,0,0,0,1,16,16,1
"eliminate all problems, it significantly improves the overall quality of your resulting PDF.","eliminate all problems, it significantly improves the overall quality of your resulting PDF.",Enhance camera image,Enhance camera image,1,0,1,1,0,12,16.02,4.02,1,0,0,0,0,0,0,1,1,1,1,0,0,0,0,1,0,1,0,0,16,16,0
Enhance camera image,Enhance camera image,1. Open the photograph or image of the document in Acrobat.,1. Open the photograph or image of the document in Acrobat.,0,18,0,0,0,16.02,12,-4.02,1,0,0,0,0,0,0,1,1,1,0,0,0,0,0,1,1,0,0,0,16,16,0
1. Open the photograph or image of the document in Acrobat.,1. Open the photograph or image of the document in Acrobat.,"2. From the All tools menu, select Scan & OCR .","2. From the All tools menu, select Scan & OCR.",1.02,0,1,0,0,12,12,0,1,0,0,0,0,0,0,1,1,1,1,0,0,0,0,1,0,0,0,1,16,16,0
"2. From the All tools menu, select Scan & OCR .","2. From the All tools menu, select Scan & OCR.","3. From the left panel, select Enhance camera image and then from the dialog that","3. From the left panel, select Enhance camera image and then from the dialog that",1.02,0,1,0,0,12,12,0,1,0,0,0,0,0,0,1,1,1,1,0,0,0,0,1,0,0,0,1,16,16,0
"3. From the left panel, select Enhance camera image and then from the dialog that","3. From the left panel, select Enhance camera image and then from the dialog that","opens, select Enhance .","opens, select Enhance.",0.02,18,0,0,0,12,12,0,1,0,0,0,0,0,0,1,1,1,0,1,0,0,0,1,0,0,0,1,16,16,1
"opens, select Enhance .","opens, select Enhance.",4. The image is enhanced and a PDF of the image is shown.,4. The image is enhanced and a PDF of the image is shown.,1,-18,0,0,0,12,12,0,1,0,0,0,0,0,0,1,1,1,1,0,0,0,0,1,0,0,0,1,16,16,0
4. The image is enhanced and a PDF of the image is shown.,4. The image is enhanced and a PDF of the image is shown.,"5. Optional To further adjust the default enhancement level, drag the Adjust","5. (Optional) To further adjust the default enhancement level, drag the Adjust",35,0,1,0,0,12,12,0,1,0,0,0,0,0,0,1,1,1,1,0,0,0,0,1,0,0,0,1,16,16,0
"5. Optional To further adjust the default enhancement level, drag the Adjust","5. (Optional) To further adjust the default enhancement level, drag the Adjust",enhancement level slider in the secondary toolbar.,enhancement level slider in the secondary toolbar.,0,18,0,0,0,12,12,0,1,0,0,0,0,0,0,1,1,1,0,1,0,0,0,1,0,0,0,1,16,16,1
