text_a,span_text_a,text_b,span_text_b,normalized_vertical_gap,indentation_change,same_alignment,is_centered_A,is_centered_B,font_size_a,font_size_b,font_size_diff,same_font,is_bold_A,is_bold_B,is_italic_A,is_italic_B,is_monospace_A,is_monospace_B,same_bold,same_italic,same_monospace,line_a_ends_punctuation,line_b_starts_lowercase,is_linea_in_rectangle,is_lineb_in_rectangle,both_in_table,neither_in_table,is_linea_hashed,is_lineb_hashed,both_hashed,neither_hashed,page_number_a,page_number_b,label
"in capacity to fulfil donor requirements might also deter smaller and/or local NGOs from seeking funding,","in capacity to fulfil donor requirements might also deter smaller and/or local NGOs from seeking funding,",undermining localization efforts. 13,undermining localization efforts.13,-0.06,0.0,1,1,0,11.0,11.0,0.0,1,0,0,0,0,0,0,1,1,1,0,1,0,0,0,1,0,0,0,1,3,3,1
undermining localization efforts. 13,undermining localization efforts.13,9 See NRC's Toolkit for Principled Humanitarian Action; Managing CT Risks.https://www.nrc.no/shorthand/stories/toolkit-for-principled-humanitarian-action/index.html,9   See NRC's Toolkit for Principled Humanitarian Action; Managing CT Risks.,2.54,0.11,1,0,0,11.0,4.52,-6.48,0,0,0,0,0,0,0,1,1,1,0,0,0,0,0,1,0,0,0,1,3,3,0
9 See NRC's Toolkit for Principled Humanitarian Action; Managing CT Risks.https://www.nrc.no/shorthand/stories/toolkit-for-principled-humanitarian-action/index.html,9   See NRC's Toolkit for Principled Humanitarian Action; Managing CT Risks.,"10 In order to ensure compliance, donors might request highly disaggregated data to corroborate their due diligence processes, ensuring their partners","10 In order to ensure compliance, donors might request highly disaggregated data to corroborate their due diligence processes, ensuring their partners",0.57,0.0,1,0,0,4.52,4.52,0.0,1,0,0,0,0,0,0,1,1,1,0,0,0,0,0,1,0,0,0,1,3,3,1
"10 In order to ensure compliance, donors might request highly disaggregated data to corroborate their due diligence processes, ensuring their partners","10 In order to ensure compliance, donors might request highly disaggregated data to corroborate their due diligence processes, ensuring their partners","are not engaging with any ‘sanctioned’ person or entity’. See Walker, J., 2020. Compliance Dialogue on Syria-Related Humanitarian Payments.https://www.graduateinstitute.ch/sites/internet/files/2020-05/26-MAY-SYRIA-Risk%20Management%20GuideFINAL.pdf","are not engaging with any ‘sanctioned’ person or entity’. See Walker, J., 2020. Compliance Dialogue on Syria-Related Humanitarian Payments.",0.3,0.0,1,0,0,4.52,7.5,2.98,0,0,0,0,0,0,0,1,1,1,0,1,0,0,0,1,0,0,0,1,3,3,1
"are not engaging with any ‘sanctioned’ person or entity’. See Walker, J., 2020. Compliance Dialogue on Syria-Related Humanitarian Payments.https://www.graduateinstitute.ch/sites/internet/files/2020-05/26-MAY-SYRIA-Risk%20Management%20GuideFINAL.pdf","are not engaging with any ‘sanctioned’ person or entity’. See Walker, J., 2020. Compliance Dialogue on Syria-Related Humanitarian Payments.","‘Sanctioned persons’ is a general term which may include individuals, terrorist groups, governments as well as companies and other entities of legal","‘Sanctioned persons’ is a general term which may include individuals, terrorist groups, governments as well as companies and other entities of legal",0.04,0.0,1,0,1,7.5,7.5,0.0,1,0,0,0,0,0,0,1,1,1,0,0,0,0,0,1,0,0,0,1,3,3,1
"‘Sanctioned persons’ is a general term which may include individuals, terrorist groups, governments as well as companies and other entities of legal","‘Sanctioned persons’ is a general term which may include individuals, terrorist groups, governments as well as companies and other entities of legal","personality. The EU, for example, has over the years considerably strengthened its legal framework for preventing money laundering and terrorism","personality. The EU, for example, has over the years considerably strengthened its legal framework for preventing money laundering and terrorism",0.04,0.0,1,1,1,7.5,7.5,0.0,1,0,0,0,0,0,0,1,1,1,0,1,0,0,0,1,0,0,0,1,3,3,1
"personality. The EU, for example, has over the years considerably strengthened its legal framework for preventing money laundering and terrorism","personality. The EU, for example, has over the years considerably strengthened its legal framework for preventing money laundering and terrorism","financing in recent years and is constantly enforcing in. See: NGO Voice, 2020. The Impact of EU Sanctions and Restrictive Measures onhttps://voiceeu.org/publications?string=VOICE+workshop+Report%3A+The+impact+of+EU+sanctions+and+restrictive+measures+on+humanitarian+action","financing in recent years and is constantly enforcing in. See: NGO Voice, 2020. The Impact of EU Sanctions and Restrictive Measures on",0.04,0.0,1,1,0,7.5,7.5,0.0,1,0,0,0,0,0,0,1,1,1,0,1,0,0,0,1,0,0,0,1,3,3,1
"financing in recent years and is constantly enforcing in. See: NGO Voice, 2020. The Impact of EU Sanctions and Restrictive Measures onhttps://voiceeu.org/publications?string=VOICE+workshop+Report%3A+The+impact+of+EU+sanctions+and+restrictive+measures+on+humanitarian+action","financing in recent years and is constantly enforcing in. See: NGO Voice, 2020. The Impact of EU Sanctions and Restrictive Measures on","11 Inter-Agency Standing Committee IASC Humanitarian Financing Task Team HFTT, 2016. Donor Conditions and their implications forhttps://interagencystandingcommittee.org/system/files/20160416donorconditionsstudyfinal.pdf","11  Inter-Agency Standing Committee (IASC) Humanitarian Financing Task Team (HFTT), 2016. Donor Conditions and their implications for",1.06,-0.0,1,0,0,7.5,4.52,-2.98,0,0,0,0,0,0,0,1,1,1,0,0,0,0,0,1,0,0,0,1,3,3,1
"11 Inter-Agency Standing Committee IASC Humanitarian Financing Task Team HFTT, 2016. Donor Conditions and their implications forhttps://interagencystandingcommittee.org/system/files/20160416donorconditionsstudyfinal.pdf","11  Inter-Agency Standing Committee (IASC) Humanitarian Financing Task Team (HFTT), 2016. Donor Conditions and their implications for","12 Publish What You Fund, 2020. Data Use Capacity in Protracted Humanitarian Crises.https://www.publishwhatyoufund.org/wp-content/uploads/dlmuploads/2020/06/Humanitarian-Research-Brief-4.pdf.","12 Publish What You Fund, 2020. Data Use Capacity in Protracted Humanitarian Crises.",1.32,0.0,1,0,0,4.52,4.52,0.0,1,0,0,0,0,0,0,1,1,1,0,0,0,0,0,1,0,0,0,1,3,3,1
"12 Publish What You Fund, 2020. Data Use Capacity in Protracted Humanitarian Crises.https://www.publishwhatyoufund.org/wp-content/uploads/dlmuploads/2020/06/Humanitarian-Research-Brief-4.pdf.","12 Publish What You Fund, 2020. Data Use Capacity in Protracted Humanitarian Crises.",THE CENTRE FOR HUMANITARIAN DATAhttps://centre.humdata.org/ DECEMBER 2020 3,THE CENTRE FOR HUMANITARIAN DATA,1.57,-0.41,1,0,0,4.52,8.0,3.48,0,0,0,0,0,0,0,1,1,1,1,0,0,0,0,1,0,0,0,1,3,3,1
Purpose limitation,Purpose limitation,"The principle of purpose limitation requires that data is only collected for specified, explicit and legitimate","The principle of purpose limitation requires that data is only collected for specified, explicit and legitimate",-0.08,0.0,1,0,1,11.0,11.0,0.0,0,1,0,0,0,0,0,0,1,1,0,0,0,0,0,1,0,0,0,1,4,4,0
"The principle of purpose limitation requires that data is only collected for specified, explicit and legitimate","The principle of purpose limitation requires that data is only collected for specified, explicit and legitimate","purposes, and that it not be processed further in a manner that would be incompatible with those","purposes, and that it not be processed further in a manner that would be incompatible with those",-0.06,0.0,1,1,1,11.0,11.0,0.0,1,0,0,0,0,0,0,1,1,1,0,1,0,0,0,1,0,0,0,1,4,4,1
"purposes, and that it not be processed further in a manner that would be incompatible with those","purposes, and that it not be processed further in a manner that would be incompatible with those",purposes. 14 Even when donors specify legitimate reasons for requesting data in-line with the original,purposes.14 Even when donors specify legitimate reasons for requesting data in-line with the original,-0.06,0.0,1,1,0,11.0,11.0,0.0,1,0,0,0,0,0,0,1,1,1,0,1,0,0,0,1,0,0,0,1,4,4,1
purposes. 14 Even when donors specify legitimate reasons for requesting data in-line with the original,purposes.14 Even when donors specify legitimate reasons for requesting data in-line with the original,"purposes for which the data was collected e.g. the delivery of humanitarian assistance, it can be difficult","purposes for which the data was collected (e.g. the delivery of humanitarian assistance), it can be difficult",-0.06,0.01,1,0,1,11.0,11.0,0.0,1,0,0,0,0,0,0,1,1,1,0,1,0,0,0,1,0,0,0,1,4,4,1
"purposes for which the data was collected e.g. the delivery of humanitarian assistance, it can be difficult","purposes for which the data was collected (e.g. the delivery of humanitarian assistance), it can be difficult",to ensure that the data will not be used for other purposes once shared. Data used out of context and for,to ensure that the data will not be used for other purposes once shared. Data used out of context and for,-0.06,0.0,1,1,1,11.0,11.0,0.0,1,0,0,0,0,0,0,1,1,1,0,1,0,0,0,1,0,0,0,1,4,4,1
to ensure that the data will not be used for other purposes once shared. Data used out of context and for,to ensure that the data will not be used for other purposes once shared. Data used out of context and for,"purposes that are not known at the time of sharing, or retained past the intended retention for a defined","purposes that are not known at the time of sharing, or retained past the intended retention for a defined",-0.06,0.0,1,1,1,11.0,11.0,0.0,1,0,0,0,0,0,0,1,1,1,0,1,0,0,0,1,0,0,0,1,4,4,1
"purposes that are not known at the time of sharing, or retained past the intended retention for a defined","purposes that are not known at the time of sharing, or retained past the intended retention for a defined","purpose represents a violation, even if unintended, of the data subjects’ rights.","purpose represents a violation, even if unintended, of the data subjects’ rights.",-0.06,0.0,1,1,0,11.0,11.0,0.0,1,0,0,0,0,0,0,1,1,1,0,1,0,0,0,1,0,0,0,1,4,4,1
"purpose represents a violation, even if unintended, of the data subjects’ rights.","purpose represents a violation, even if unintended, of the data subjects’ rights.",RECOMMENDATIONS,RECOMMENDATIONS,1.96,1.07,1,0,0,11.0,11.0,0.0,0,0,1,0,0,0,0,0,1,1,1,0,0,0,0,1,0,0,0,1,4,4,0
RECOMMENDATIONS,RECOMMENDATIONS,"In view of the objectives and constraints detailed above, the Centre, the Humanitarian Policy Group HPG","In view of the objectives and constraints detailed above, the Centre, the Humanitarian Policy Group (HPG)",0.8,-0.08,1,0,1,11.0,11.0,0.0,0,1,0,0,0,0,0,0,1,1,0,0,0,0,0,1,0,0,0,1,4,4,0
"In view of the objectives and constraints detailed above, the Centre, the Humanitarian Policy Group HPG","In view of the objectives and constraints detailed above, the Centre, the Humanitarian Policy Group (HPG)","at ODI, the ICRC, and the Human Security Division of the Swiss Federal Department of Foreign Affairs","at ODI, the ICRC, and the Human Security Division of the Swiss Federal Department of Foreign Affairs",-0.06,0.0,1,1,1,11.0,11.0,0.0,1,0,0,0,0,0,0,1,1,1,0,1,0,0,0,1,0,0,0,1,4,4,1
"at ODI, the ICRC, and the Human Security Division of the Swiss Federal Department of Foreign Affairs","at ODI, the ICRC, and the Human Security Division of the Swiss Federal Department of Foreign Affairs",recommend that donors and humanitarian organizations take the following steps to minimize risks while,recommend that donors and humanitarian organizations take the following steps to minimize risks while,-0.06,0.0,1,1,1,11.0,11.0,0.0,1,0,0,0,0,0,0,1,1,1,0,1,0,0,0,1,0,0,0,1,4,4,1
recommend that donors and humanitarian organizations take the following steps to minimize risks while,recommend that donors and humanitarian organizations take the following steps to minimize risks while,maximizing benefits when sharing sensitive data:,maximizing benefits when sharing sensitive data:,-0.06,0.0,1,1,0,11.0,11.0,0.0,1,0,0,0,0,0,0,1,1,1,0,1,0,0,0,1,0,0,0,1,4,4,1
maximizing benefits when sharing sensitive data:,maximizing benefits when sharing sensitive data:,• Reviewing and clarifying the formal or informal frameworks that govern the collection and,Reviewing and clarifying the formal or informal frameworks that govern the collection and,1.0,11.34,0,0,1,11.0,11.0,0.0,0,0,1,0,0,0,0,0,1,1,1,0,0,0,0,1,0,0,0,1,4,4,0
• Reviewing and clarifying the formal or informal frameworks that govern the collection and,Reviewing and clarifying the formal or informal frameworks that govern the collection and,sharing of disaggregated data,sharing of disaggregated data,-0.11,11.34,0,1,0,11.0,11.0,0.0,1,1,1,0,0,0,0,1,1,1,0,1,0,0,0,1,0,0,0,1,4,4,1
sharing of disaggregated data,sharing of disaggregated data,"Donors and partners should examine the official, formal requirements and ad-hoc, informal","Donors and partners should examine the official, formal requirements and ad-hoc, informal",-0.08,0.0,1,0,1,11.0,11.0,0.0,0,1,0,0,0,0,0,0,1,1,0,0,0,0,0,1,0,0,0,1,4,4,0
"Donors and partners should examine the official, formal requirements and ad-hoc, informal","Donors and partners should examine the official, formal requirements and ad-hoc, informal","requirements of data sharing, and analyse partner and donor staff interpret whether requirements","requirements of data sharing, and analyse partner and donor staff interpret whether requirements",-0.06,0.0,1,1,1,11.0,11.0,0.0,1,0,0,0,0,0,0,1,1,1,0,1,0,0,0,1,0,0,0,1,4,4,1
"requirements of data sharing, and analyse partner and donor staff interpret whether requirements","requirements of data sharing, and analyse partner and donor staff interpret whether requirements",correctly and consistently. They should assess whether there are implicit conditionalities between the,correctly and consistently. They should assess whether there are implicit conditionalities between the,-0.06,0.0,1,1,1,11.0,11.0,0.0,1,0,0,0,0,0,0,1,1,1,0,1,0,0,0,1,0,0,0,1,4,4,1
correctly and consistently. They should assess whether there are implicit conditionalities between the,correctly and consistently. They should assess whether there are implicit conditionalities between the,willingness to share disaggregated data and the ability of different organizations to access and sustain,willingness to share disaggregated data and the ability of different organizations to access and sustain,-0.06,0.0,1,1,1,11.0,11.0,0.0,1,0,0,0,0,0,0,1,1,1,0,1,0,0,0,1,0,0,0,1,4,4,1
willingness to share disaggregated data and the ability of different organizations to access and sustain,willingness to share disaggregated data and the ability of different organizations to access and sustain,funding from donors.,funding from donors.,-0.06,0.0,1,1,0,11.0,11.0,0.0,1,0,0,0,0,0,0,1,1,1,0,1,0,0,0,1,0,0,0,1,4,4,1
funding from donors.,funding from donors.,• Formalizing and standardizing requests for sensitive data,Formalizing and standardizing requests for sensitive data,1.0,-11.34,0,0,0,11.0,11.0,0.0,0,0,1,0,0,0,0,0,1,1,1,0,0,0,0,1,0,0,0,1,4,4,0
• Formalizing and standardizing requests for sensitive data,Formalizing and standardizing requests for sensitive data,"When sensitive data is required to meet a mutually agreed objective, donors should formalize and","When sensitive data is required to meet a mutually agreed objective, donors should formalize and",-0.08,11.34,0,0,1,11.0,11.0,0.0,0,1,0,0,0,0,0,0,1,1,0,0,0,0,0,1,0,0,0,1,4,4,0
"When sensitive data is required to meet a mutually agreed objective, donors should formalize and","When sensitive data is required to meet a mutually agreed objective, donors should formalize and",standardize their requests for such data. Requests should be made in writing and should specify,standardize their requests for such data. Requests should be made in writing and should specify,-0.06,0.0,1,1,1,11.0,11.0,0.0,1,0,0,0,0,0,0,1,1,1,0,1,0,0,0,1,0,0,0,1,4,4,1
standardize their requests for such data. Requests should be made in writing and should specify,standardize their requests for such data. Requests should be made in writing and should specify,"which data is requested, the format desired, and the intended use of the data. Donors should only","which data is requested, the format desired, and the intended use of the data. Donors should only",-0.06,0.0,1,1,1,11.0,11.0,0.0,1,0,0,0,0,0,0,1,1,1,0,1,0,0,0,1,0,0,0,1,4,4,1
"which data is requested, the format desired, and the intended use of the data. Donors should only","which data is requested, the format desired, and the intended use of the data. Donors should only",request the information required to meet the specified purpose for which it is being requested and,request the information required to meet the specified purpose for which it is being requested and,-0.06,0.0,1,1,1,11.0,11.0,0.0,1,0,0,0,0,0,0,1,1,1,0,1,0,0,0,1,0,0,0,1,4,4,1
request the information required to meet the specified purpose for which it is being requested and,request the information required to meet the specified purpose for which it is being requested and,should indicate a timeline for destruction of the data. Humanitarian organisations should document,should indicate a timeline for destruction of the data. Humanitarian organisations should document,-0.06,0.0,1,1,1,11.0,11.0,0.0,1,0,0,0,0,0,0,1,1,1,0,1,0,0,0,1,0,0,0,1,4,4,1
should indicate a timeline for destruction of the data. Humanitarian organisations should document,should indicate a timeline for destruction of the data. Humanitarian organisations should document,all requests for data and ensure consistency in responding to these requests over time.,all requests for data and ensure consistency in responding to these requests over time.,-0.06,0.0,1,1,1,11.0,11.0,0.0,1,0,0,0,0,0,0,1,1,1,0,1,0,0,0,1,0,0,0,1,4,4,1
all requests for data and ensure consistency in responding to these requests over time.,all requests for data and ensure consistency in responding to these requests over time.,• Investing in data management capacities of staff and organizations,Investing in data management capacities of staff and organizations,1.0,-11.34,0,1,0,11.0,11.0,0.0,0,0,1,0,0,0,0,0,1,1,1,0,0,0,0,1,0,0,0,1,4,4,0
• Investing in data management capacities of staff and organizations,Investing in data management capacities of staff and organizations,Donors and humanitarian organizations should identify opportunities to invest in building data,Donors and humanitarian organizations should identify opportunities to invest in building data,-0.08,11.34,0,0,1,11.0,11.0,0.0,0,1,0,0,0,0,0,0,1,1,0,0,0,0,0,1,0,0,0,1,4,4,0
Donors and humanitarian organizations should identify opportunities to invest in building data,Donors and humanitarian organizations should identify opportunities to invest in building data,management expertise especially for non-technical staff. The donor community is uniquely positioned,management expertise especially for non-technical staff. The donor community is uniquely positioned,-0.06,0.0,1,1,1,11.0,11.0,0.0,1,0,0,0,0,0,0,1,1,1,0,1,0,0,0,1,0,0,0,1,4,4,1
management expertise especially for non-technical staff. The donor community is uniquely positioned,management expertise especially for non-technical staff. The donor community is uniquely positioned,to encourage data responsibility by providing additional resources for training and capacity building.,to encourage data responsibility by  providing additional  resources for training and capacity building.,-0.06,0.0,1,1,1,11.0,11.0,0.0,1,0,0,0,0,0,0,1,1,1,0,1,0,0,0,1,0,0,0,1,4,4,1
to encourage data responsibility by providing additional resources for training and capacity building.,to encourage data responsibility by  providing additional  resources for training and capacity building.,• Adopting common principles for donor data management,Adopting common principles for donor data management,1.0,-11.34,0,1,0,11.0,11.0,0.0,0,0,1,0,0,0,0,0,1,1,1,0,0,0,0,1,0,0,0,1,4,4,0
• Adopting common principles for donor data management,Adopting common principles for donor data management,The sector already has a range of principles and commitments to inform different aspects of,The sector already has a range of principles and commitments to inform different aspects of,-0.08,11.34,0,0,1,11.0,11.0,0.0,0,1,0,0,0,0,0,0,1,1,0,0,0,0,0,1,0,0,0,1,4,4,0
The sector already has a range of principles and commitments to inform different aspects of,The sector already has a range of principles and commitments to inform different aspects of,"humanitarian donorship. 15 However, these do not sufficiently address concerns related to data","humanitarian donorship.15 However, these do not sufficiently address concerns related to data",-0.06,0.0,1,1,0,11.0,11.0,0.0,1,0,0,0,0,0,0,1,1,1,0,1,0,0,0,1,0,0,0,1,4,4,1
"humanitarian donorship. 15 However, these do not sufficiently address concerns related to data","humanitarian donorship.15 However, these do not sufficiently address concerns related to data",responsibility. Donors and partners should engage in the development of common principles and,responsibility. Donors and partners should engage in the development of common principles and,-0.06,-0.0,1,0,1,11.0,11.0,0.0,1,0,0,0,0,0,0,1,1,1,0,1,0,0,0,1,0,0,0,1,4,4,1
responsibility. Donors and partners should engage in the development of common principles and,responsibility. Donors and partners should engage in the development of common principles and,"guidelines for donor data sharing to fill this gap. The Humanitarian Data and Trust Initiativehttps://centre.humdata.org/introducing-the-humanitarian-data-and-trust-initiative/, co-led","guidelines for donor data sharing to fill this gap. The Humanitarian Data and Trust Initiative, co-led",-0.06,0.0,1,1,0,11.0,11.0,0.0,1,0,0,0,0,0,0,1,1,1,0,1,0,0,0,1,0,0,0,1,4,4,1
"guidelines for donor data sharing to fill this gap. The Humanitarian Data and Trust Initiativehttps://centre.humdata.org/introducing-the-humanitarian-data-and-trust-initiative/, co-led","guidelines for donor data sharing to fill this gap. The Humanitarian Data and Trust Initiative, co-led","by the Government of Switzerland, the ICRC, and the Centre, offers a platform to facilitate this process","by the Government of Switzerland, the ICRC, and the Centre, offers a platform to facilitate this process",-0.06,0.0,1,0,1,11.0,11.0,0.0,1,0,0,0,0,0,0,1,1,1,0,1,0,0,0,1,0,0,0,1,4,4,1
"by the Government of Switzerland, the ICRC, and the Centre, offers a platform to facilitate this process","by the Government of Switzerland, the ICRC, and the Centre, offers a platform to facilitate this process",as part of its ongoing work to build trust through dialogue.,as part of its ongoing work to build trust through dialogue.,-0.06,0.0,1,1,0,11.0,11.0,0.0,1,0,0,0,0,0,0,1,1,1,0,1,0,0,0,1,0,0,0,1,4,4,1
as part of its ongoing work to build trust through dialogue.,as part of its ongoing work to build trust through dialogue.,Organizations are encouraged to share their experience in responsible data sharing with donors with the,Organizations are encouraged to share their experience in responsible data sharing with donors with the,1.04,-22.68,0,0,1,11.0,11.0,0.0,1,0,0,0,0,0,0,1,1,1,1,0,0,0,0,1,0,0,0,1,4,4,0
Organizations are encouraged to share their experience in responsible data sharing with donors with the,Organizations are encouraged to share their experience in responsible data sharing with donors with the,Centre for Humanitarian Data via centrehumdata@un.orgmailto:centrehumdata%40un.org?subject= .,Centre for Humanitarian Data via centrehumdata@un.org.,-0.06,0.0,1,1,0,11.0,11.0,0.0,1,0,0,0,0,0,0,1,1,1,0,0,0,0,0,1,0,0,0,1,4,4,1
Centre for Humanitarian Data via centrehumdata@un.orgmailto:centrehumdata%40un.org?subject= .,Centre for Humanitarian Data via centrehumdata@un.org.,"14 ICRC, 2020. Handbook on data protection in humanitarian action.https://www.icrc.org/en/data-protection-humanitarian-action-handbook","14  ICRC, 2020. Handbook on data protection in humanitarian action.",6.64,-0.16,1,0,0,11.0,4.52,-6.48,0,0,0,0,0,0,0,1,1,1,1,0,0,0,0,1,0,0,0,1,4,4,0
"14 ICRC, 2020. Handbook on data protection in humanitarian action.https://www.icrc.org/en/data-protection-humanitarian-action-handbook","14  ICRC, 2020. Handbook on data protection in humanitarian action.",15 Examples include the Good Humanitarian Donorship Initiative and the Grand Bargain.https://www.ghdinitiative.org/ghd/gns/home-page.html,15  Examples include the Good Humanitarian Donorship Initiative and the Grand Bargain.,0.56,0.0,1,0,0,4.52,4.52,0.0,1,0,0,0,0,0,0,1,1,1,0,0,0,0,0,1,0,0,0,1,4,4,1
15 Examples include the Good Humanitarian Donorship Initiative and the Grand Bargain.https://www.ghdinitiative.org/ghd/gns/home-page.html,15  Examples include the Good Humanitarian Donorship Initiative and the Grand Bargain.,THE CENTRE FOR HUMANITARIAN DATAhttps://centre.humdata.org/ DECEMBER 2020 4,THE CENTRE FOR HUMANITARIAN DATA,1.5,-0.41,1,0,0,4.52,8.0,3.48,0,0,0,0,0,0,0,1,1,1,0,0,0,0,0,1,0,0,0,1,4,4,1
COLLABORATORS: THE HUMANITARIAN POLICY GROUP AT ODI; INTERNATIONAL COMMITTEE OF THE RED CROSS;https://www.odi.org/our-work/programmes/humanitarian-policy-group/about,COLLABORATORS: THE HUMANITARIAN POLICY GROUP AT ODI; INTERNATIONAL COMMITTEE OF THE RED CROSS;,"AND THE HUMAN SECURITY DIVISION, SWISS FEDERAL DEPARTMENT OF FOREIGN AFFAIRS.https://www.fdfa.admin.ch/eda/en/fdfa/fdfa/organisation-fdfa/directorates-divisions/directorate-political-affairs/hsd.html","AND THE HUMAN SECURITY DIVISION, SWISS FEDERAL DEPARTMENT OF FOREIGN AFFAIRS.",-0.03,0.0,1,0,0,10.0,10.0,0.0,1,0,0,0,0,0,0,1,1,1,0,0,0,0,0,1,0,0,0,1,5,5,1
