text_a,span_text_a,text_b,span_text_b,normalized_vertical_gap,indentation_change,same_alignment,is_centered_A,is_centered_B,font_size_a,font_size_b,font_size_diff,same_font,is_bold_A,is_bold_B,is_italic_A,is_italic_B,is_monospace_A,is_monospace_B,same_bold,same_italic,same_monospace,line_a_ends_punctuation,line_b_starts_lowercase,is_linea_in_rectangle,is_lineb_in_rectangle,both_in_table,neither_in_table,is_linea_hashed,is_lineb_hashed,both_hashed,neither_hashed,page_number_a,page_number_b,label
THE CENTRE FOR HUMANITARIAN DATA,THE CENTRE FOR HUMANITARIAN DATA,GUIDANCE NOTE SERIES,GUIDANCE NOTE SERIES,2.23,-0.65,1,0,0,14.0,12.0,-2.0,0,1,1,0,0,0,0,1,1,1,0,0,0,0,0,1,1,0,0,0,1,1,0
GUIDANCE NOTE SERIES,GUIDANCE NOTE SERIES,DATA RESPONSIBILITY IN HUMANITARIAN ACTION,DATA RESPONSIBILITY IN HUMANITARIAN ACTION,0.2,0.0,1,0,0,12.0,12.0,0.0,1,1,1,0,0,0,0,1,1,1,0,0,0,0,0,1,0,0,0,1,1,1,1
DATA RESPONSIBILITY IN HUMANITARIAN ACTION,DATA RESPONSIBILITY IN HUMANITARIAN ACTION,RESPONSIBLE DATA SHARING WITH DONORS,RESPONSIBLE DATA SHARING WITH DONORS,1.0,0.0,1,0,1,12.0,19.0,7.0,0,1,1,0,0,0,0,1,1,1,0,0,0,0,0,1,0,1,0,0,1,1,0
RESPONSIBLE DATA SHARING WITH DONORS,RESPONSIBLE DATA SHARING WITH DONORS,KEY TAKEAWAYS:,KEY TAKEAWAYS:,2.65,10.41,0,1,0,19.0,11.0,-8.0,1,1,1,0,0,0,0,1,1,1,0,0,0,0,0,1,1,0,0,0,1,1,0
KEY TAKEAWAYS:,KEY TAKEAWAYS:,Sharing sensitive personal and non-personal data without adequate safeguards can exacerbate,Sharing sensitive personal and non-personal data without adequate safeguards can exacerbate,0.75,11.26,0,0,1,11.0,11.0,0.0,0,1,0,0,0,0,0,0,1,1,1,0,0,0,0,1,0,0,0,1,1,1,0
Sharing sensitive personal and non-personal data without adequate safeguards can exacerbate,Sharing sensitive personal and non-personal data without adequate safeguards can exacerbate,"risks for crisis-affected people, humanitarian organizations and donors.","risks for crisis-affected people, humanitarian organizations and donors.",-0.06,11.34,0,1,1,11.0,11.0,0.0,1,0,0,0,0,0,0,1,1,1,0,1,0,0,0,1,0,0,0,1,1,1,1
"risks for crisis-affected people, humanitarian organizations and donors.","risks for crisis-affected people, humanitarian organizations and donors.",Donors regularly request data from the organizations they fund in order to fulfil their obligations,Donors regularly request data from the organizations they fund in order to fulfil their obligations,1.0,-11.34,0,1,1,11.0,11.0,0.0,1,0,0,0,0,0,0,1,1,1,1,0,0,0,0,1,0,0,0,1,1,1,0
Donors regularly request data from the organizations they fund in order to fulfil their obligations,Donors regularly request data from the organizations they fund in order to fulfil their obligations,and objectives. Some of these requests relate to sensitive information and data which needs to,and objectives. Some of these requests relate to sensitive information and data which needs to,-0.06,11.34,0,1,1,11.0,11.0,0.0,1,0,0,0,0,0,0,1,1,1,0,1,0,0,0,1,0,0,0,1,1,1,1
and objectives. Some of these requests relate to sensitive information and data which needs to,and objectives. Some of these requests relate to sensitive information and data which needs to,be protected in order to mitigate risk.,be protected in order to mitigate risk.,-0.06,0.0,1,1,0,11.0,11.0,0.0,1,0,0,0,0,0,0,1,1,1,0,1,0,0,0,1,0,0,0,1,1,1,1
be protected in order to mitigate risk.,be protected in order to mitigate risk.,Common objectives for data sharing with donors include: i situational awareness and,Common objectives for data sharing with donors include: (i) situational awareness and,1.0,-11.34,0,0,1,11.0,11.0,0.0,1,0,0,0,0,0,0,1,1,1,1,0,0,0,0,1,0,0,0,1,1,1,0
Common objectives for data sharing with donors include: i situational awareness and,Common objectives for data sharing with donors include: (i) situational awareness and,"programme design; ii accountability and transparency; and iii legal, regulatory, and policy","programme design; (ii) accountability and transparency; and (iii) legal, regulatory, and policy",-0.06,11.34,0,1,1,11.0,11.0,0.0,1,0,0,0,0,0,0,1,1,1,0,1,0,0,0,1,0,0,0,1,1,1,1
"programme design; ii accountability and transparency; and iii legal, regulatory, and policy","programme design; (ii) accountability and transparency; and (iii) legal, regulatory, and policy",requirements.,requirements.,-0.06,0.0,1,1,0,11.0,11.0,0.0,1,0,0,0,0,0,0,1,1,1,0,1,0,0,0,1,0,0,0,1,1,1,1
requirements.,requirements.,Common constraints related to sharing data with donors include: i lack of regulatory framework,Common constraints related to sharing data with donors include: (i) lack of regulatory framework,1.21,-11.34,0,0,1,11.0,11.0,0.0,1,0,0,0,0,0,0,1,1,1,1,0,0,0,0,1,0,0,0,1,1,1,0
Common constraints related to sharing data with donors include: i lack of regulatory framework,Common constraints related to sharing data with donors include: (i) lack of regulatory framework,for responsibly managing sensitive non-personal data; ii capacity gaps; and iii purpose,for responsibly managing sensitive non-personal data; (ii) capacity gaps; and (iii) purpose,-0.06,11.34,0,1,1,11.0,11.0,0.0,1,0,0,0,0,0,0,1,1,1,0,1,0,0,0,1,0,0,0,1,1,1,1
for responsibly managing sensitive non-personal data; ii capacity gaps; and iii purpose,for responsibly managing sensitive non-personal data; (ii) capacity gaps; and (iii) purpose,limitation.,limitation.,-0.06,0.0,1,1,0,11.0,11.0,0.0,1,0,0,0,0,0,0,1,1,1,0,1,0,0,0,1,0,0,0,1,1,1,1
limitation.,limitation.,Donors and humanitarian organizations can take the following steps to minimize risks while,Donors and humanitarian organizations can take the following steps to minimize risks while,1.0,-11.34,0,0,1,11.0,11.0,0.0,1,0,0,0,0,0,0,1,1,1,1,0,0,0,0,1,0,0,0,1,1,1,0
Donors and humanitarian organizations can take the following steps to minimize risks while,Donors and humanitarian organizations can take the following steps to minimize risks while,maximizing benefits when sharing sensitive data: i reviewing and clarifying the formal or,maximizing benefits when sharing sensitive data: (i) reviewing and clarifying the formal or,-0.06,11.34,0,1,1,11.0,11.0,0.0,1,0,0,0,0,0,0,1,1,1,0,1,0,0,0,1,0,0,0,1,1,1,1
maximizing benefits when sharing sensitive data: i reviewing and clarifying the formal or,maximizing benefits when sharing sensitive data: (i) reviewing and clarifying the formal or,informal frameworks that govern the collection and sharing of disaggregated data; ii formalizing,informal frameworks that govern the collection and sharing of disaggregated data; (ii) formalizing,-0.06,0.0,1,1,1,11.0,11.0,0.0,1,0,0,0,0,0,0,1,1,1,0,1,0,0,0,1,0,0,0,1,1,1,1
informal frameworks that govern the collection and sharing of disaggregated data; ii formalizing,informal frameworks that govern the collection and sharing of disaggregated data; (ii) formalizing,and standardising requests for sensitive data; iii investing in data management capacities of,and standardising requests for sensitive data; (iii) investing in data management capacities of,-0.06,0.0,1,1,1,11.0,11.0,0.0,1,0,0,0,0,0,0,1,1,1,0,1,0,0,0,1,0,0,0,1,1,1,1
and standardising requests for sensitive data; iii investing in data management capacities of,and standardising requests for sensitive data; (iii) investing in data management capacities of,staff and organisations; and iv adopting common principles for donor data management.,staff and organisations; and (iv) adopting common principles for donor data management.,-0.06,0.0,1,1,1,11.0,11.0,0.0,1,0,0,0,0,0,0,1,1,1,0,1,0,0,0,1,0,0,0,1,1,1,1
staff and organisations; and iv adopting common principles for donor data management.,staff and organisations; and (iv) adopting common principles for donor data management.,INTRODUCTION,INTRODUCTION,3.17,-32.79,0,1,0,11.0,11.0,0.0,0,0,1,0,0,0,0,0,1,1,1,0,0,0,0,1,0,0,0,1,1,1,0
INTRODUCTION,INTRODUCTION,"Donors have an important role in the humanitarian data ecosystem, both as drivers of increased data","Donors have an important role in the humanitarian data ecosystem, both as drivers of increased data",0.94,-0.08,1,0,1,11.0,11.0,0.0,0,1,0,0,0,0,0,0,1,1,0,0,0,0,0,1,0,0,0,1,1,1,0
"Donors have an important role in the humanitarian data ecosystem, both as drivers of increased data","Donors have an important role in the humanitarian data ecosystem, both as drivers of increased data","collection and analysis, and as direct users of data. This is not a new phenomenon; the need for","collection and analysis, and as direct users of data. This is not a new phenomenon; the need for",-0.06,0.0,1,1,1,11.0,11.0,0.0,1,0,0,0,0,0,0,1,1,1,0,1,0,0,0,1,0,0,0,1,1,1,1
"collection and analysis, and as direct users of data. This is not a new phenomenon; the need for","collection and analysis, and as direct users of data. This is not a new phenomenon; the need for","accountability and transparency in the use of donor funding is broadly understood and respected. However,","accountability and transparency in the use of donor funding is broadly understood and respected. However,",-0.06,0.0,1,1,1,11.0,11.0,0.0,1,0,0,0,0,0,0,1,1,1,0,1,0,0,0,1,0,0,0,1,1,1,1
"accountability and transparency in the use of donor funding is broadly understood and respected. However,","accountability and transparency in the use of donor funding is broadly understood and respected. However,","in recent years, donors have begun requesting data that can be sensitive. This includes personal data about","in recent years, donors have begun requesting data that can be sensitive. This includes personal data about",-0.06,0.0,1,1,1,11.0,11.0,0.0,1,0,0,0,0,0,0,1,1,1,0,1,0,0,0,1,0,0,0,1,1,1,1
"in recent years, donors have begun requesting data that can be sensitive. This includes personal data about","in recent years, donors have begun requesting data that can be sensitive. This includes personal data about","beneficiaries and various forms of disaggregated data, such as household-level survey results and data","beneficiaries and various forms of disaggregated data, such as household-level survey results and data",-0.06,0.0,1,1,1,11.0,11.0,0.0,1,0,0,0,0,0,0,1,1,1,0,1,0,0,0,1,0,0,0,1,1,1,1
"beneficiaries and various forms of disaggregated data, such as household-level survey results and data","beneficiaries and various forms of disaggregated data, such as household-level survey results and data","about the delivery of assistance disaggregated by demographic and/or group dimensions e.g. ethnicity,","about the delivery of assistance disaggregated by demographic and/or group dimensions (e.g. ethnicity,",-0.06,0.0,1,1,1,11.0,11.0,0.0,1,0,0,0,0,0,0,1,1,1,0,1,0,0,0,1,0,0,0,1,1,1,1
"about the delivery of assistance disaggregated by demographic and/or group dimensions e.g. ethnicity,","about the delivery of assistance disaggregated by demographic and/or group dimensions (e.g. ethnicity,","protection group, etc.. 1","protection group, etc.).1",-0.06,0.0,1,1,0,11.0,11.0,0.0,1,0,0,0,0,0,0,1,1,1,0,1,0,0,0,1,0,0,0,1,1,1,1
"protection group, etc.. 1","protection group, etc.).1",Concerns around requests for such data have led donors and humanitarian organizations to place more,Concerns around requests for such data have led donors and humanitarian organizations to place more,1.21,-0.02,1,0,1,11.0,11.0,0.0,1,0,0,0,0,0,0,1,1,1,0,0,0,0,0,1,0,0,0,1,1,1,0
Concerns around requests for such data have led donors and humanitarian organizations to place more,Concerns around requests for such data have led donors and humanitarian organizations to place more,"emphasis on identifying strategies for data responsibility: the safe, ethical and effective management","emphasis on identifying strategies for data responsibility: the safe, ethical and effective management",-0.06,0.0,1,1,1,11.0,11.0,0.0,1,0,0,0,0,0,0,1,1,1,0,1,0,0,0,1,0,0,0,1,1,1,1
"emphasis on identifying strategies for data responsibility: the safe, ethical and effective management","emphasis on identifying strategies for data responsibility: the safe, ethical and effective management",of data. Data responsibility requires donors and humanitarian organizations to take actions that help,of data. Data responsibility requires donors and humanitarian organizations to take actions that help,-0.06,0.0,1,1,1,11.0,11.0,0.0,1,0,0,0,0,0,0,1,1,1,0,1,0,0,0,1,0,0,0,1,1,1,1
of data. Data responsibility requires donors and humanitarian organizations to take actions that help,of data. Data responsibility requires donors and humanitarian organizations to take actions that help,minimize risks while maximizing benefits of data. This is particularly challenging in cases where donors,minimize risks while maximizing benefits of data. This is particularly challenging in cases where donors,-0.06,0.0,1,1,1,11.0,11.0,0.0,1,0,0,0,0,0,0,1,1,1,0,1,0,0,0,1,0,0,0,1,1,1,1
minimize risks while maximizing benefits of data. This is particularly challenging in cases where donors,minimize risks while maximizing benefits of data. This is particularly challenging in cases where donors,"request sensitive data. For example, the screening of aid recipients, which is often used to justify requests","request sensitive data. For example, the screening of aid recipients, which is often used to justify requests",-0.06,0.0,1,1,1,11.0,11.0,0.0,1,0,0,0,0,0,0,1,1,1,0,1,0,0,0,1,0,0,0,1,1,1,1
"request sensitive data. For example, the screening of aid recipients, which is often used to justify requests","request sensitive data. For example, the screening of aid recipients, which is often used to justify requests","for personal data, is not only difficult to practically implement, but also highly problematic in terms of","for personal data, is not only difficult to practically implement, but also highly problematic in terms of",-0.06,0.0,1,1,1,11.0,11.0,0.0,1,0,0,0,0,0,0,1,1,1,0,1,0,0,0,1,0,0,0,1,1,1,1
"for personal data, is not only difficult to practically implement, but also highly problematic in terms of","for personal data, is not only difficult to practically implement, but also highly problematic in terms of",principled aid. 2,principled aid.2,-0.06,0.0,1,1,0,11.0,11.0,0.0,1,0,0,0,0,0,0,1,1,1,0,1,0,0,0,1,0,0,0,1,1,1,1
principled aid. 2,principled aid.2,"1 Because there are well-established and accepted standards and mechanisms for sharing financial information with donors, including a role for external","1     Because there are well-established and accepted standards and mechanisms for sharing financial information with donors, including a role for external",0.5,0.42,1,0,0,11.0,4.52,-6.48,0,0,0,0,0,0,0,1,1,1,0,0,0,0,0,1,0,0,0,1,1,1,0
"1 Because there are well-established and accepted standards and mechanisms for sharing financial information with donors, including a role for external","1     Because there are well-established and accepted standards and mechanisms for sharing financial information with donors, including a role for external","audits, requests for financial data are not included in this guidance note. This guidance note deals with sensitive personal and non-personal data.","audits, requests for financial data are not included in this guidance note. This guidance note deals with sensitive personal and non-personal data.",0.35,0.0,1,0,1,4.52,7.5,2.98,0,0,0,0,0,0,0,1,1,1,0,1,0,0,0,1,0,0,0,1,1,1,1
"audits, requests for financial data are not included in this guidance note. This guidance note deals with sensitive personal and non-personal data.","audits, requests for financial data are not included in this guidance note. This guidance note deals with sensitive personal and non-personal data.","2 Roepstorff, K., Faltas, C. and Hövelmann, S., 2020. Counterterrorism Measures and Sanction Regimes: Shrinking Space for Humanitarian Aidhttps://www.chaberlin.org/en/publications/counterterrorism-measures-and-sanction-regimes-shrinking-space-for-humanitarian-aid-organisations/","2    Roepstorff, K., Faltas, C. and Hövelmann, S., 2020. Counterterrorism Measures and Sanction Regimes: Shrinking Space for Humanitarian Aid",0.35,-0.0,1,1,0,7.5,4.52,-2.98,0,0,0,0,0,0,0,1,1,1,1,0,0,0,0,1,0,0,0,1,1,1,0
"2 Roepstorff, K., Faltas, C. and Hövelmann, S., 2020. Counterterrorism Measures and Sanction Regimes: Shrinking Space for Humanitarian Aidhttps://www.chaberlin.org/en/publications/counterterrorism-measures-and-sanction-regimes-shrinking-space-for-humanitarian-aid-organisations/","2    Roepstorff, K., Faltas, C. and Hövelmann, S., 2020. Counterterrorism Measures and Sanction Regimes: Shrinking Space for Humanitarian Aid",THE CENTRE FOR HUMANITARIAN DATAhttps://centre.humdata.org/ DECEMBER 2020 1,THE CENTRE FOR HUMANITARIAN DATA,2.65,-0.41,1,0,0,4.52,8.0,3.48,0,0,0,0,0,0,0,1,1,1,0,0,0,0,0,1,0,0,0,1,1,1,1
"In addition, sharing seemingly innocuous data such as aggregated survey results can place already","In addition, sharing seemingly innocuous data such as aggregated survey results can place already",vulnerable people and communities at greater risk. What may be initially considered non-personal data 3,vulnerable people and communities at greater risk. What may be initially considered non-personal data3,-0.06,0.0,1,1,1,11.0,11.0,0.0,1,0,0,0,0,0,0,1,1,1,0,1,0,0,0,1,0,0,0,1,2,2,1
vulnerable people and communities at greater risk. What may be initially considered non-personal data 3,vulnerable people and communities at greater risk. What may be initially considered non-personal data3,"can allow for re-identification of individuals, communities and demographic groups. Re-identification","can allow for re-identification of individuals, communities and demographic groups. Re-identification",-0.06,0.0,1,1,1,11.0,11.0,0.0,1,0,0,0,0,0,0,1,1,1,0,1,0,0,0,1,0,0,0,1,2,2,1
"can allow for re-identification of individuals, communities and demographic groups. Re-identification","can allow for re-identification of individuals, communities and demographic groups. Re-identification",occurs when data can be traced back or linked to an individuals or groups of individuals because it is not,occurs when data can be traced back or linked to an individual(s) or group(s) of individuals because it is not,-0.06,0.0,1,1,1,11.0,11.0,0.0,1,0,0,0,0,0,0,1,1,1,0,1,0,0,0,1,0,0,0,1,2,2,1
occurs when data can be traced back or linked to an individuals or groups of individuals because it is not,occurs when data can be traced back or linked to an individual(s) or group(s) of individuals because it is not,"adequately anonymized. This can result in a violation of data protection, privacy and other human rights","adequately anonymized. This can result in a violation of data protection, privacy and other human rights",-0.06,0.0,1,1,1,11.0,11.0,0.0,1,0,0,0,0,0,0,1,1,1,0,1,0,0,0,1,0,0,0,1,2,2,1
"adequately anonymized. This can result in a violation of data protection, privacy and other human rights","adequately anonymized. This can result in a violation of data protection, privacy and other human rights",and can allow for targeting of individuals or groups with violence or other forms of harm. 4,and can allow for targeting of individuals or groups with violence or other forms of harm.4,-0.06,0.0,1,1,1,11.0,11.0,0.0,1,0,0,0,0,0,0,1,1,1,0,1,0,0,0,1,0,0,0,1,2,2,1
and can allow for targeting of individuals or groups with violence or other forms of harm. 4,and can allow for targeting of individuals or groups with violence or other forms of harm.4,Many donors and humanitarian actors recognize the risks and benefits associated with sharing such,Many donors and humanitarian actors recognize the risks and benefits associated with sharing such,0.86,-0.0,1,1,1,11.0,11.0,0.0,1,0,0,0,0,0,0,1,1,1,0,0,0,0,0,1,0,0,0,1,2,2,0
Many donors and humanitarian actors recognize the risks and benefits associated with sharing such,Many donors and humanitarian actors recognize the risks and benefits associated with sharing such,"sensitive data, but the sector has yet to establish a common understanding of how to balance these risks","sensitive data, but the sector has yet to establish a common understanding of how to balance these risks",-0.06,0.0,1,1,1,11.0,11.0,0.0,1,0,0,0,0,0,0,1,1,1,0,1,0,0,0,1,0,0,0,1,2,2,1
"sensitive data, but the sector has yet to establish a common understanding of how to balance these risks","sensitive data, but the sector has yet to establish a common understanding of how to balance these risks","and benefits effectively. Recent efforts to address this issue have led to more clarity on current practices,","and benefits effectively. Recent efforts to address this issue have led to more clarity on current practices,",-0.06,0.0,1,1,1,11.0,11.0,0.0,1,0,0,0,0,0,0,1,1,1,0,1,0,0,0,1,0,0,0,1,2,2,1
"and benefits effectively. Recent efforts to address this issue have led to more clarity on current practices,","and benefits effectively. Recent efforts to address this issue have led to more clarity on current practices,","as well as on the objectives and constraints of data sharing. In September 2020, the Government of","as well as on the objectives and constraints of data sharing. In September 2020, the Government of",-0.06,0.0,1,1,1,11.0,11.0,0.0,1,0,0,0,0,0,0,1,1,1,0,1,0,0,0,1,0,0,0,1,2,2,1
"as well as on the objectives and constraints of data sharing. In September 2020, the Government of","as well as on the objectives and constraints of data sharing. In September 2020, the Government of","Switzerland, the International Committee of the Red Cross ICRC and the United Nations Office for","Switzerland, the International Committee of the Red Cross (ICRC) and the United Nations Office for",-0.06,0.0,1,1,1,11.0,11.0,0.0,1,0,0,0,0,0,0,1,1,1,0,0,0,0,0,1,0,0,0,1,2,2,1
"Switzerland, the International Committee of the Red Cross ICRC and the United Nations Office for","Switzerland, the International Committee of the Red Cross (ICRC) and the United Nations Office for",Coordination of Humanitarian Affairs UN OCHA Centre for Humanitarian Data the Centre organized a,Coordination of Humanitarian Affairs (UN OCHA) Centre for Humanitarian Data (the Centre) organized a,-0.06,0.0,1,1,1,11.0,11.0,0.0,1,0,0,0,0,0,0,1,1,1,0,0,0,0,0,1,0,0,0,1,2,2,1
Coordination of Humanitarian Affairs UN OCHA Centre for Humanitarian Data the Centre organized a,Coordination of Humanitarian Affairs (UN OCHA) Centre for Humanitarian Data (the Centre) organized a,virtual Wilton Park dialogue to help build common understanding on this issue. 5,virtual Wilton Park dialogue to help build common understanding on this issue.5,-0.06,0.0,1,1,0,11.0,11.0,0.0,1,0,0,0,0,0,0,1,1,1,0,1,0,0,0,1,0,0,0,1,2,2,1
virtual Wilton Park dialogue to help build common understanding on this issue. 5,virtual Wilton Park dialogue to help build common understanding on this issue.5,This guidance note synthesizes the outcomes of this dialogue and a related desk review. 6 It describes the,This guidance note synthesizes the outcomes of this dialogue and a related desk review.6 It describes the,1.04,0.0,1,0,1,11.0,11.0,0.0,1,0,0,0,0,0,0,1,1,1,0,0,0,0,0,1,0,0,0,1,2,2,0
This guidance note synthesizes the outcomes of this dialogue and a related desk review. 6 It describes the,This guidance note synthesizes the outcomes of this dialogue and a related desk review.6 It describes the,challenges around sharing sensitive data with donors and offers initial recommendations for how donors,challenges around sharing sensitive data with donors and offers initial recommendations for how donors,-0.06,-0.0,1,1,1,11.0,11.0,0.0,1,0,0,0,0,0,0,1,1,1,0,1,0,0,0,1,0,0,0,1,2,2,1
challenges around sharing sensitive data with donors and offers initial recommendations for how donors,challenges around sharing sensitive data with donors and offers initial recommendations for how donors,and humanitarian organizations can more effectively navigate this area.,and humanitarian organizations can more effectively navigate this area.,-0.06,0.0,1,1,0,11.0,11.0,0.0,1,0,0,0,0,0,0,1,1,1,0,1,0,0,0,1,0,0,0,1,2,2,1
and humanitarian organizations can more effectively navigate this area.,and humanitarian organizations can more effectively navigate this area.,DONOR REQUESTS FOR DATA,DONOR REQUESTS FOR DATA,1.31,0.08,1,0,0,11.0,11.0,0.0,0,0,1,0,0,0,0,0,1,1,1,0,0,0,0,1,0,0,0,1,2,2,0
DONOR REQUESTS FOR DATA,DONOR REQUESTS FOR DATA,Donors regularly request data from their partners in order to fulfil different obligations and objectives.,Donors regularly request data from their partners in order to fulfil different obligations and objectives.,0.8,-0.08,1,0,1,11.0,11.0,0.0,0,1,0,0,0,0,0,0,1,1,0,0,0,0,0,1,0,0,0,1,2,2,0
Donors regularly request data from their partners in order to fulfil different obligations and objectives.,Donors regularly request data from their partners in order to fulfil different obligations and objectives.,These requests can be either formal or informal.,These requests can be either formal or informal.,-0.06,0.0,1,1,0,11.0,11.0,0.0,1,0,0,0,0,0,0,1,1,1,1,0,0,0,0,1,0,0,0,1,2,2,1
These requests can be either formal or informal.,These requests can be either formal or informal.,"• Formal requests tend to be included in grant agreements in relation to reporting criteria, and are","Formal requests tend to be included in grant agreements in relation to reporting criteria, and are",1.0,11.34,0,0,0,11.0,11.0,0.0,0,0,1,0,0,0,0,0,1,1,1,0,0,0,0,1,0,0,0,1,2,2,0
"• Formal requests tend to be included in grant agreements in relation to reporting criteria, and are","Formal requests tend to be included in grant agreements in relation to reporting criteria, and are",typically based on legal requirements such as compliance with counter-terrorism laws. Such requests,typically based on legal requirements such as compliance with counter-terrorism laws. Such requests,-0.08,11.34,0,0,1,11.0,11.0,0.0,0,1,0,0,0,0,0,0,1,1,0,1,0,0,0,1,0,0,0,1,2,2,1
