text_a,span_text_a,text_b,span_text_b,normalized_vertical_gap,indentation_change,same_alignment,is_centered_A,is_centered_B,font_size_a,font_size_b,font_size_diff,same_font,is_bold_A,is_bold_B,is_italic_A,is_italic_B,is_monospace_A,is_monospace_B,same_bold,same_italic,same_monospace,line_a_ends_punctuation,line_b_starts_lowercase,is_linea_in_rectangle,is_lineb_in_rectangle,both_in_table,neither_in_table,is_linea_hashed,is_lineb_hashed,both_hashed,neither_hashed,label
responsibility in practice. This series is made possible with the generous support of the Directorate-General for,responsibility in practice. This series is made possible with the generous support of the Directorate-General for,European Civil Protection and Humanitarian Aid Operations DG ECHO.,European Civil Protection and Humanitarian Aid Operations (DG ECHO).,-3.79,0,1,1,1,10,10,0,1,0,0,0,0,0,0,1,1,1,0,0,0,0,0,1,0,0,0,1,1
European Civil Protection and Humanitarian Aid Operations DG ECHO.,European Civil Protection and Humanitarian Aid Operations (DG ECHO).,This document covers humanitarian aid activities implemented with the financial assistance of the,This document covers humanitarian aid activities implemented with the financial assistance of the,1.18,-12,0,1,1,10,9,-1,1,0,0,0,0,0,0,1,1,1,1,0,0,0,0,1,0,0,0,1,0
This document covers humanitarian aid activities implemented with the financial assistance of the,This document covers humanitarian aid activities implemented with the financial assistance of the,"European Union. The views expressed herein should not be taken, in any way, to reflect the official opinion","European Union. The views expressed herein should not be taken, in any way, to reflect the official opinion",-6.1,0,1,1,1,9,9,0,1,0,0,0,0,0,0,1,1,1,0,0,0,0,0,1,0,0,0,1,1
"European Union. The views expressed herein should not be taken, in any way, to reflect the official opinion","European Union. The views expressed herein should not be taken, in any way, to reflect the official opinion","of the European Union, and the European Commission is not responsible for any use that may be made of","of the European Union, and the European Commission is not responsible for any use that may be made of",-6.1,0,1,1,1,9,9,0,1,0,0,0,0,0,0,1,1,1,0,1,0,0,0,1,0,0,0,1,1
"of the European Union, and the European Commission is not responsible for any use that may be made of","of the European Union, and the European Commission is not responsible for any use that may be made of",the information it contains.,the information it contains.,-6.1,0,1,1,1,9,9,0,1,0,0,0,0,0,0,1,1,1,0,1,0,0,0,1,0,0,0,1,1
the information it contains.,the information it contains.,This project is co-funded,This project is co-funded,-6.1,0,1,1,1,9,7.65,-1.35,1,0,0,0,0,0,0,1,1,1,1,0,0,0,0,1,0,0,0,1,0
This project is co-funded,This project is co-funded,by the European Union,by the European Union,-6.1,0,1,1,1,7.65,7.65,0,1,0,0,0,0,0,0,1,1,1,0,1,0,0,0,1,0,0,0,1,1
by the European Union,by the European Union,THE CENTRE FOR HUMANITARIAN DATAhttps://centre.humdata.org/ DECEMBER 2020 5,THE CENTRE FOR HUMANITARIAN DATA,-6.1,0,1,1,1,7.65,8,0.35,1,0,0,0,0,0,0,1,1,1,0,0,0,0,0,1,0,0,0,1,1
