text_a,span_text_a,text_b,span_text_b,normalized_vertical_gap,indentation_change,same_alignment,is_centered_A,is_centered_B,font_size_a,font_size_b,font_size_diff,same_font,is_bold_A,is_bold_B,is_italic_A,is_italic_B,is_monospace_A,is_monospace_B,same_bold,same_italic,same_monospace,line_a_ends_punctuation,line_b_starts_lowercase,is_linea_in_rectangle,is_lineb_in_rectangle,both_in_table,neither_in_table,is_linea_hashed,is_lineb_hashed,both_hashed,neither_hashed,page_number_a,page_number_b,label
Replace pages in a PDF,Replace pages in a PDF,1. Open the PDF that contains the pages you want to replace.,1. Open the PDF that contains the pages you want to replace.,0.99,18,0,0,0,16.02,12,-4.02,0,1,0,0,0,0,0,0,1,1,0,0,0,0,0,1,1,0,0,0,11,11,0
1. Open the PDF that contains the pages you want to replace.,1. Open the PDF that contains the pages you want to replace.,2. Select All tools   - Organize pages . The page thumbnails are displayed in the,2. Select All tools > Organize pages. The page thumbnails are displayed in the,1.01,0,1,0,0,12,12,0,1,0,0,0,0,0,0,1,1,1,1,0,0,0,0,1,0,0,0,1,11,11,0
2. Select All tools   - Organize pages . The page thumbnails are displayed in the,2. Select All tools > Organize pages. The page thumbnails are displayed in the,Document area.,Document area.,0,18,0,0,0,12,12,0,1,0,0,0,0,0,0,1,1,1,0,0,0,0,0,1,0,0,0,1,11,11,1
Document area.,Document area.,"3. In the left tools pane, select Replace . The file explorer window appears.","3. In the left tools pane, select Replace. The file explorer window appears.",1.01,-18,0,0,0,12,12,0,1,0,0,0,0,0,0,1,1,1,1,0,0,0,0,1,0,0,0,1,11,11,0
"3. In the left tools pane, select Replace . The file explorer window appears.","3. In the left tools pane, select Replace. The file explorer window appears.",4. Select the document containing the replacement pages.,4. Select the document containing the replacement pages.,0.99,0,1,0,0,12,12,0,1,0,0,0,0,0,0,1,1,1,1,0,0,0,0,1,0,0,0,1,11,11,0
4. Select the document containing the replacement pages.,4. Select the document containing the replacement pages.,"5. In the Replace Pages dialog box, under Original, enter the pages to be replaced in the","5. In the Replace Pages dialog box, under Original, enter the pages to be replaced in the",1.01,0,1,0,0,12,12,0,1,0,0,0,0,0,0,1,1,1,1,0,0,0,0,1,0,0,0,1,11,11,0
"5. In the Replace Pages dialog box, under Original, enter the pages to be replaced in the","5. In the Replace Pages dialog box, under Original, enter the pages to be replaced in the",original document.,original document.,0,18,0,0,0,12,12,0,1,0,0,0,0,0,0,1,1,1,0,1,0,0,0,1,0,0,0,1,11,11,1
original document.,original document.,"6. In the Replace Pages dialog box, under Replacement, enter the first page of the","6. In the Replace Pages dialog box, under Replacement, enter the first page of the",1.01,-18,0,0,0,12,12,0,1,0,0,0,0,0,0,1,1,1,1,0,0,0,0,1,0,0,0,1,11,11,0
"6. In the Replace Pages dialog box, under Replacement, enter the first page of the","6. In the Replace Pages dialog box, under Replacement, enter the first page of the",replacement page range. The last page is calculated based on the number of pages to,replacement page range. The last page is calculated based on the number of pages to,0,18,0,0,1,12,12,0,1,0,0,0,0,0,0,1,1,1,0,1,0,0,0,1,0,0,0,1,11,11,1
replacement page range. The last page is calculated based on the number of pages to,replacement page range. The last page is calculated based on the number of pages to,be replaced in the original document.,be replaced in the original document.,0,0,1,1,0,12,12,0,1,0,0,0,0,0,0,1,1,1,0,1,0,0,0,1,0,0,0,1,11,11,1
be replaced in the original document.,be replaced in the original document.,7. Select OK .,7. Select OK.,1.01,-18,0,0,0,12,12,0,1,0,0,0,0,0,0,1,1,1,1,0,0,0,0,1,0,0,0,1,11,11,0
7. Select OK .,7. Select OK.,Replace pages between multiple PDFs,Replace pages between multiple PDFs,3.59,-18,0,0,0,12,16.02,4.02,0,0,1,0,0,0,0,0,1,1,1,0,0,0,0,1,0,1,0,0,11,11,0
Replace pages between multiple PDFs,Replace pages between multiple PDFs,"1. Open the PDF that contains the pages you want to replace, and then open the PDF","1. Open the PDF that contains the pages you want to replace, and then open the PDF",0,18,0,0,0,16.02,12,-4.02,0,1,0,0,0,0,0,0,1,1,0,0,0,0,0,1,1,0,0,0,11,11,0
"1. Open the PDF that contains the pages you want to replace, and then open the PDF","1. Open the PDF that contains the pages you want to replace, and then open the PDF",that contains the replacement pages.,that contains the replacement pages.,0,18,0,0,0,12,12,0,1,0,0,0,0,0,0,1,1,1,0,1,0,0,0,1,0,0,0,1,11,11,1
that contains the replacement pages.,that contains the replacement pages.,2. Select All tools   - Organize pages for both PDFs. The page thumbnails are displayed in,2. Select All tools > Organize pages for both PDFs. The page thumbnails are displayed in,1.01,-18,0,0,0,12,12,0,1,0,0,0,0,0,0,1,1,1,1,0,0,0,0,1,0,0,0,1,11,11,0
2. Select All tools   - Organize pages for both PDFs. The page thumbnails are displayed in,2. Select All tools > Organize pages for both PDFs. The page thumbnails are displayed in,the Document area.,the Document area.,0,18,0,0,0,12,12,0,1,0,0,0,0,0,0,1,1,1,0,1,0,0,0,1,0,0,0,1,11,11,1
"3. In the PDF containing the replacement pages, select a page or group of pages you","3. In the PDF containing the replacement pages, select a page or group of pages you","want as replacements. For Windows, press Ctrl and then select the pages; for MacOS,","want as replacements. For Windows, press Ctrl and then select the pages; for MacOS,",7864.5,18,0,0,0,12,12,0,1,0,0,0,0,0,0,1,1,1,0,1,0,0,0,1,0,0,0,1,12,12,1
"want as replacements. For Windows, press Ctrl and then select the pages; for MacOS,","want as replacements. For Windows, press Ctrl and then select the pages; for MacOS,",press Command and then select the pages.,press Command and then select the pages.,7864.5,0,1,0,0,12,12,0,1,0,0,0,0,0,0,1,1,1,0,1,0,0,0,1,0,0,0,1,12,12,1
press Command and then select the pages.,press Command and then select the pages.,4. Press Ctrl Windows or command macOS and then drag the selected page,4. Press Ctrl (Windows) or command (macOS) and then drag the selected page,499384.5,-18,0,0,0,12,12,0,1,0,0,0,0,0,0,1,1,1,1,0,0,0,0,1,0,0,0,1,12,12,0
4. Press Ctrl Windows or command macOS and then drag the selected page,4. Press Ctrl (Windows) or command (macOS) and then drag the selected page,thumbnails in the document area of the target document where thumbnails are,thumbnails in the document area of the target document where thumbnails are,-3,18,0,0,1,12,12,0,1,0,0,0,0,0,0,1,1,1,0,1,0,0,0,1,0,0,0,1,12,12,1
thumbnails in the document area of the target document where thumbnails are,thumbnails in the document area of the target document where thumbnails are,displayed. Release the mouse button when the pointer is directly over the page,displayed. Release the mouse button when the pointer is directly over the page,1,0,1,1,1,12,12,0,1,0,0,0,0,0,0,1,1,1,0,1,0,0,0,1,0,0,0,1,12,12,1
displayed. Release the mouse button when the pointer is directly over the page,displayed. Release the mouse button when the pointer is directly over the page,number box of the page thumbnail you want to replace. The corresponding pages are,number box of the page thumbnail you want to replace. The corresponding pages are,1,0,1,1,1,12,12,0,1,0,0,0,0,0,0,1,1,1,0,1,0,0,0,1,0,0,0,1,12,12,1
number box of the page thumbnail you want to replace. The corresponding pages are,number box of the page thumbnail you want to replace. The corresponding pages are,highlighted.,highlighted.,1,0,1,1,0,12,12,0,1,0,0,0,0,0,0,1,1,1,0,1,0,0,0,1,0,0,0,1,12,12,1
highlighted.,highlighted.,The pages you selected in the first document replace an equal number of pages in the,The pages you selected in the first document replace an equal number of pages in the,1336933,0,1,0,1,12,12,0,1,0,0,0,0,0,0,1,1,1,1,0,0,0,0,1,0,0,0,1,12,12,0
The pages you selected in the first document replace an equal number of pages in the,The pages you selected in the first document replace an equal number of pages in the,second document. It starts at the page number that you selected to drop the new,second document. It starts at the page number that you selected to drop the new,1,0,1,1,1,12,12,0,1,0,0,0,0,0,0,1,1,1,0,1,0,0,0,1,0,0,0,1,12,12,1
second document. It starts at the page number that you selected to drop the new,second document. It starts at the page number that you selected to drop the new,pages.,pages.,1,0,1,1,0,12,12,0,1,0,0,0,0,0,0,1,1,1,0,1,0,0,0,1,0,0,0,1,12,12,1
Renumber pages in a PDF,Renumber pages in a PDF,The page numbers on the document pages don't always match the page numbers that appear,The page numbers on the document pages don't always match the page numbers that appear,124.88,0,1,0,1,24,12,-12,0,1,0,0,0,0,0,0,1,1,0,0,0,0,0,1,1,0,0,0,13,13,0
The page numbers on the document pages don't always match the page numbers that appear,The page numbers on the document pages don't always match the page numbers that appear,below the page thumbnails and in the right Page Navigation toolbar. Pages are numbered,below the page thumbnails and in the right Page Navigation toolbar. Pages are numbered,1,0,1,1,0,12,12,0,1,0,0,0,0,0,0,1,1,1,0,1,0,0,0,1,0,0,0,1,13,13,1
below the page thumbnails and in the right Page Navigation toolbar. Pages are numbered,below the page thumbnails and in the right Page Navigation toolbar. Pages are numbered,"with integers, starting with page 1 for the first page of the document. Because some PDFs may","with integers, starting with page 1 for the first page of the document. Because some PDFs may",0,0,1,0,1,12,12,0,1,0,0,0,0,0,0,1,1,1,0,1,0,0,0,1,0,0,0,1,13,13,1
"with integers, starting with page 1 for the first page of the document. Because some PDFs may","with integers, starting with page 1 for the first page of the document. Because some PDFs may","contain front matter, such as a copyright page and table of contents, their body pages may","contain front matter, such as a copyright page and table of contents, their body pages may",0,0,1,1,1,12,12,0,1,0,0,0,0,0,0,1,1,1,0,1,0,0,0,1,0,0,0,1,13,13,1
"contain front matter, such as a copyright page and table of contents, their body pages may","contain front matter, such as a copyright page and table of contents, their body pages may",not follow the numbering shown in the right Page Navigation toolbar.,not follow the numbering shown in the right Page Navigation toolbar.,1,0,1,1,0,12,12,0,1,0,0,0,0,0,0,1,1,1,0,1,0,0,0,1,0,0,0,1,13,13,1
not follow the numbering shown in the right Page Navigation toolbar.,not follow the numbering shown in the right Page Navigation toolbar.,"You can specify various numbering styles for a group of pages, for example, 1, 2, 3, or i, ii, iii, or","You can specify various numbering styles for a group of pages, for example, 1, 2, 3, or i, ii, iii, or",1309.8,0,1,0,1,12,12,0,1,0,0,0,0,0,0,1,1,1,1,0,0,0,0,1,0,0,0,1,13,13,0
"You can specify various numbering styles for a group of pages, for example, 1, 2, 3, or i, ii, iii, or","You can specify various numbering styles for a group of pages, for example, 1, 2, 3, or i, ii, iii, or","a, b, c. You can also customize the numbering system by adding a prefix. For example, pages","a, b, c. You can also customize the numbering system by adding a prefix. For example, pages",0,0,1,1,1,12,12,0,1,0,0,0,0,0,0,1,1,1,0,1,0,0,0,1,0,0,0,1,13,13,1
"a, b, c. You can also customize the numbering system by adding a prefix. For example, pages","a, b, c. You can also customize the numbering system by adding a prefix. For example, pages","in Chapter 1 can be 1-1, 1-2, 1-3, and so on. Chapter 2 can have pages numbered as 2-1, 2-2, 2-3,","in Chapter 1 can be 1-1, 1-2, 1-3, and so on. Chapter 2 can have pages numbered as 2-1, 2-2, 2-3,",0,0,1,1,1,12,12,0,1,0,0,0,0,0,0,1,1,1,0,1,0,0,0,1,0,0,0,1,13,13,1
"in Chapter 1 can be 1-1, 1-2, 1-3, and so on. Chapter 2 can have pages numbered as 2-1, 2-2, 2-3,","in Chapter 1 can be 1-1, 1-2, 1-3, and so on. Chapter 2 can have pages numbered as 2-1, 2-2, 2-3,",and so on.,and so on.,0,0,1,1,0,12,12,0,1,0,0,0,0,0,0,1,1,1,0,1,0,0,0,1,0,0,0,1,13,13,1
and so on.,and so on.,Note: Using the Number Pages command affects only the page thumbnails on,Note: Using the Number Pages command affects only the page thumbnails on,116.48,0,1,0,0,12,12,0,0,0,1,0,0,0,0,0,1,1,1,0,0,0,0,1,0,0,0,1,13,13,0
Note: Using the Number Pages command affects only the page thumbnails on,Note: Using the Number Pages command affects only the page thumbnails on,the Pages panel. You can physically add new page numbers to a PDF using the headers and,the Pages panel. You can physically add new page numbers to a PDF using the headers and,2.3,0,1,0,0,12,12,0,0,1,0,0,0,0,0,0,1,1,0,1,0,0,0,1,0,0,0,1,13,13,1
the Pages panel. You can physically add new page numbers to a PDF using the headers and,the Pages panel. You can physically add new page numbers to a PDF using the headers and,footers feature.,footers feature.,0,0,1,0,0,12,12,0,1,0,0,0,0,0,0,1,1,1,0,1,0,0,0,1,0,0,0,1,13,13,1
footers feature.,footers feature.,1. Select All tools from the global bar. Then select Organize pages > Page labels.,1. Select All tools from the global bar. Then select Organize pages > Page labels.,117.48,18,0,0,0,12,12,0,1,0,0,0,0,0,0,1,1,1,1,0,0,0,0,1,0,0,0,1,13,13,0
1. Select All tools from the global bar. Then select Organize pages > Page labels.,1. Select All tools from the global bar. Then select Organize pages > Page labels.,2. Specify a page range.  Selected implies pages selected in the Page Thumbnails panel.,2. Specify a page range. (Selected implies pages selected in the Page Thumbnails panel.),1,0,1,0,0,12,12,0,1,0,0,0,0,0,0,1,1,1,1,0,0,0,0,1,0,0,0,1,13,13,1
2. Specify a page range.  Selected implies pages selected in the Page Thumbnails panel.,2. Specify a page range. (Selected implies pages selected in the Page Thumbnails panel.),"3. Select one of the following, and then select OK :","3. Select one of the following, and then select OK:",1,0,1,0,0,12,12,0,1,0,0,0,0,0,0,1,1,1,1,0,0,0,0,1,0,0,0,1,13,13,1
"3. Select one of the following, and then select OK :","3. Select one of the following, and then select OK:",Begin New Section : Starts a new numbering sequence. Choose a style from the pop-up,Begin New Section: Starts a new numbering sequence. Choose a style from the pop-up,356.45,-18,0,0,0,12,12,0,0,0,1,0,0,0,0,0,1,1,1,0,0,0,0,1,0,0,0,1,13,13,0
Begin New Section : Starts a new numbering sequence. Choose a style from the pop-up,Begin New Section: Starts a new numbering sequence. Choose a style from the pop-up,"menu, and enter a starting page number for the section. Specify a Prefix, if desired.","menu, and enter a starting page number for the section. Specify a Prefix, if desired.",1.8,0,1,0,0,12,12,0,0,1,0,0,0,0,0,0,1,1,0,1,0,0,0,1,0,0,0,1,13,13,1
"menu, and enter a starting page number for the section. Specify a Prefix, if desired.","menu, and enter a starting page number for the section. Specify a Prefix, if desired.",Extend Numbering Used In Preceding Section To Selected Pages : Continues the numbering,Extend Numbering Used In Preceding Section To Selected Pages: Continues the numbering,355.95,0,1,0,0,12,12,0,0,0,1,0,0,0,0,0,1,1,1,0,0,0,0,1,0,0,0,1,13,13,0
Extend Numbering Used In Preceding Section To Selected Pages : Continues the numbering,Extend Numbering Used In Preceding Section To Selected Pages: Continues the numbering,sequence from previous pages without interruption.,sequence from previous pages without interruption.,0.8,0,1,0,0,12,12,0,0,1,0,0,0,0,0,0,1,1,0,1,0,0,0,1,0,0,0,1,13,13,1
Edit Scanned PDFs,Edit Scanned PDFs,"Editing a scanned PDF can be complicated if it includes low-quality text or images, noneditable text, line breaks, or complex formatting. Other inhibiting factors include compatibility","editable text, line breaks, or complex formatting. Other inhibiting factors include compatibility",299.83,0,1,0,1,24,12,-12,0,1,0,0,0,0,0,0,1,1,0,0,0,0,0,1,1,0,0,0,14,14,0
"Editing a scanned PDF can be complicated if it includes low-quality text or images, noneditable text, line breaks, or complex formatting. Other inhibiting factors include compatibility","editable text, line breaks, or complex formatting. Other inhibiting factors include compatibility","issues, security restrictions, and large file sizes, which are more prevalent in PDFs created from","issues, security restrictions, and large file sizes, which are more prevalent in PDFs created from",0,0,1,1,1,12,12,0,1,0,0,0,0,0,0,1,1,1,0,1,0,0,0,1,0,0,0,1,14,14,1
"issues, security restrictions, and large file sizes, which are more prevalent in PDFs created from","issues, security restrictions, and large file sizes, which are more prevalent in PDFs created from",scanned images.,scanned images.,0,0,1,1,0,12,12,0,1,0,0,0,0,0,0,1,1,1,0,1,0,0,0,1,0,0,0,1,14,14,1
scanned images.,scanned images.,"To streamline the process, consider the following best practices and guidelines before editing","To streamline the process, consider the following best practices and guidelines before editing",145.6,0,1,0,1,12,12,0,1,0,0,0,0,0,0,1,1,1,1,0,0,0,0,1,0,0,0,1,14,14,0
"To streamline the process, consider the following best practices and guidelines before editing","To streamline the process, consider the following best practices and guidelines before editing",a scanned document:,a scanned document:,0,0,1,1,0,12,12,0,1,0,0,0,0,0,0,1,1,1,0,1,0,0,0,1,0,0,0,1,14,14,1
a scanned document:,a scanned document:,Check the accuracy of optical character recognition OCR output . When you open a,Check the accuracy of optical character recognition (OCR) output. When you open a,146.23,0,1,0,0,12,12,0,0,0,1,0,0,0,0,0,1,1,1,0,0,0,0,1,0,0,0,1,14,14,0
Check the accuracy of optical character recognition OCR output . When you open a,Check the accuracy of optical character recognition (OCR) output. When you open a,"scanned document, Acrobat automatically runs OCRhttps://www.adobe.com/acrobat/resources/what-is-ocr.html in the background to make the","scanned document, Acrobat automatically runs OCR in the background to make the",1,0,1,0,0,12,12,0,0,1,0,0,0,0,0,0,1,1,0,1,0,0,0,1,0,0,0,1,14,14,1
"scanned document, Acrobat automatically runs OCRhttps://www.adobe.com/acrobat/resources/what-is-ocr.html in the background to make the","scanned document, Acrobat automatically runs OCR in the background to make the","document editable. Before editing, review the document to ensure that the content is","document editable. Before editing, review the document to ensure that the content is",0,0,1,0,1,12,12,0,1,0,0,0,0,0,0,1,1,1,0,1,0,0,0,1,0,0,0,1,14,14,1
"document editable. Before editing, review the document to ensure that the content is","document editable. Before editing, review the document to ensure that the content is","accurate and complete. If necessary, rescan the document using the Scan & OCR - Recognize","accurate and complete. If necessary, rescan the document using the Scan & OCR > Recognize",1.25,0,1,1,0,12,12,0,1,0,0,0,0,0,0,1,1,1,0,1,0,0,0,1,0,0,0,1,14,14,1
"accurate and complete. If necessary, rescan the document using the Scan & OCR - Recognize","accurate and complete. If necessary, rescan the document using the Scan & OCR > Recognize",Text tool to improve the output.,Text tool to improve the output.,0,0,1,0,0,12,12,0,0,0,1,0,0,0,0,0,1,1,0,0,0,0,0,1,0,0,0,1,14,14,1
Text tool to improve the output.,Text tool to improve the output.,"Enhance image quality . If the scanned PDF contains low-quality images, use the Enhance","Enhance image quality. If the scanned PDF contains low-quality images, use the Enhance",146.6,0,1,0,0,12,12,0,1,1,1,0,0,0,0,1,1,1,1,0,0,0,0,1,0,0,0,1,14,14,0
"Enhance image quality . If the scanned PDF contains low-quality images, use the Enhance","Enhance image quality. If the scanned PDF contains low-quality images, use the Enhance",scanned file or Enhance camera image feature to improve the quality of images before,scanned file or Enhance camera image feature to improve the quality of images before,1,0,1,0,0,12,12,0,1,1,1,0,0,0,0,1,1,1,0,1,0,0,0,1,0,0,0,1,14,14,1
scanned file or Enhance camera image feature to improve the quality of images before,scanned file or Enhance camera image feature to improve the quality of images before,"attempting to edit the document. For more information, see Scan documents to PDF.","attempting to edit the document. For more information, see Scan documents to PDF.",1,0,1,0,0,12,12,0,0,1,0,0,0,0,0,0,1,1,0,1,0,0,0,1,0,0,0,1,14,14,1
"attempting to edit the document. For more information, see Scan documents to PDF.","attempting to edit the document. For more information, see Scan documents to PDF.","Use the correct font and formatting . When editing the document, ensure that the font and","Use the correct font and formatting. When editing the document, ensure that the font and",145.6,0,1,0,0,12,12,0,0,0,1,0,0,0,0,0,1,1,1,0,0,0,0,1,0,0,0,1,14,14,0
"Use the correct font and formatting . When editing the document, ensure that the font and","Use the correct font and formatting. When editing the document, ensure that the font and",formatting of the edited text match the original document as closely as possible. If you don't,formatting of the edited text match the original document as closely as possible. If you don't,1,0,1,0,1,12,12,0,0,1,0,0,0,0,0,0,1,1,0,1,0,0,0,1,0,0,0,1,14,14,1
formatting of the edited text match the original document as closely as possible. If you don't,formatting of the edited text match the original document as closely as possible. If you don't,"have the desired fonts on your computer, see Add fonts to your computer.https://helpx.adobe.com/fonts/kb/add-fonts-desktop.html","have the desired fonts on your computer, see Add fonts to your computer.",0,0,1,1,0,12,12,0,1,0,0,0,0,0,0,1,1,1,0,1,0,0,0,1,0,0,0,1,14,14,1
"have the desired fonts on your computer, see Add fonts to your computer.https://helpx.adobe.com/fonts/kb/add-fonts-desktop.html","have the desired fonts on your computer, see Add fonts to your computer.","Remove security restrictions . If the scanned PDF has security restrictions that prevent editing,","Remove security restrictions. If the scanned PDF has security restrictions that prevent editing,",146.23,0,1,0,0,12,12,0,0,0,1,0,0,0,0,0,1,1,0,0,0,0,0,1,0,0,0,1,14,14,0
"Remove security restrictions . If the scanned PDF has security restrictions that prevent editing,","Remove security restrictions. If the scanned PDF has security restrictions that prevent editing,",remove these restrictions before attempting to edit the document. To know how to remove,remove these restrictions before attempting to edit the document. To know how to remove,1,0,1,0,1,12,12,0,0,1,0,0,0,0,0,0,1,1,0,1,0,0,0,1,0,0,0,1,14,14,1
remove these restrictions before attempting to edit the document. To know how to remove,remove these restrictions before attempting to edit the document. To know how to remove,"security from a PDF, see Unlock a PDF.","security from a PDF, see Unlock a PDF.",0,0,1,1,0,12,12,0,1,0,0,0,0,0,0,1,1,1,0,1,0,0,0,1,0,0,0,1,14,14,1
"security from a PDF, see Unlock a PDF.","security from a PDF, see Unlock a PDF.","Avoid editing complex elements . If the scanned PDF contains tables, graphs, or images,","Avoid editing complex elements. If the scanned PDF contains tables, graphs, or images,",145.6,0,1,0,0,12,12,0,0,0,1,0,0,0,0,0,1,1,1,0,0,0,0,1,0,0,0,1,14,14,0
"Avoid editing complex elements . If the scanned PDF contains tables, graphs, or images,","Avoid editing complex elements. If the scanned PDF contains tables, graphs, or images,",avoid unnecessary edits that could alter the layout or formatting of these elements.,avoid unnecessary edits that could alter the layout or formatting of these elements.,1,0,1,0,1,12,12,0,0,1,0,0,0,0,0,0,1,1,0,1,0,0,0,1,0,0,0,1,14,14,1
avoid unnecessary edits that could alter the layout or formatting of these elements.,avoid unnecessary edits that could alter the layout or formatting of these elements.,Check for compatibility issues . Ensure that the version of Adobe Acrobat you're using is,Check for compatibility issues. Ensure that the version of Adobe Acrobat you're using is,145.6,0,1,1,0,12,12,0,0,0,1,0,0,0,0,0,1,1,1,0,0,0,0,1,0,0,0,1,14,14,0
Check for compatibility issues . Ensure that the version of Adobe Acrobat you're using is,Check for compatibility issues. Ensure that the version of Adobe Acrobat you're using is,"compatible with the scanned PDF. If you encounter compatibility issues, try updating Adobe","compatible with the scanned PDF. If you encounter compatibility issues, try updating Adobe",1,0,1,0,1,12,12,0,0,1,0,0,0,0,0,0,1,1,0,1,0,0,0,1,0,0,0,1,14,14,1
"compatible with the scanned PDF. If you encounter compatibility issues, try updating Adobe","compatible with the scanned PDF. If you encounter compatibility issues, try updating Adobe","Acrobat. For more information, see System requirements.https://helpx.adobe.com/acrobat/system-requirements.html","Acrobat. For more information, see System requirements.",0,0,1,1,0,12,12,0,1,0,0,0,0,0,0,1,1,1,0,0,0,0,0,1,0,0,0,1,14,14,1
"Acrobat. For more information, see System requirements.https://helpx.adobe.com/acrobat/system-requirements.html","Acrobat. For more information, see System requirements.",Save a backup copy . Always save a backup copy of the original scanned PDF before making,Save a backup copy. Always save a backup copy of the original scanned PDF before making,146.23,0,1,0,0,12,12,0,0,0,1,0,0,0,0,0,1,1,0,0,0,0,0,1,0,0,0,1,14,14,0
Save a backup copy . Always save a backup copy of the original scanned PDF before making,Save a backup copy. Always save a backup copy of the original scanned PDF before making,any edits. Revert to the original document if any issues arise during the editing process.,any edits. Revert to the original document if any issues arise during the editing process.,1,0,1,0,1,12,12,0,0,1,0,0,0,0,0,0,1,1,0,1,0,0,0,1,0,0,0,1,14,14,1
