text_a,span_text_a,text_b,span_text_b,normalized_vertical_gap,indentation_change,same_alignment,is_centered_A,is_centered_B,font_size_a,font_size_b,font_size_diff,same_font,is_bold_A,is_bold_B,is_italic_A,is_italic_B,is_monospace_A,is_monospace_B,same_bold,same_italic,same_monospace,line_a_ends_punctuation,line_b_starts_lowercase,is_linea_in_rectangle,is_lineb_in_rectangle,both_in_table,neither_in_table,is_linea_hashed,is_lineb_hashed,both_hashed,neither_hashed,page_number_a,page_number_b,label
"AND THE HUMAN SECURITY DIVISION, SWISS FEDERAL DEPARTMENT OF FOREIGN AFFAIRS.https://www.fdfa.admin.ch/eda/en/fdfa/fdfa/organisation-fdfa/directorates-divisions/directorate-political-affairs/hsd.html","AND THE HUMAN SECURITY DIVISION, SWISS FEDERAL DEPARTMENT OF FOREIGN AFFAIRS.","The Centre for Humanitarian Datahttps://centre.humdata.org 'the Center', together with key partners, is publishing a series of eight","The Centre for Humanitarian Data ('the Center'), together with key partners, is publishing a series of eight",1.0,11.83,0,0,0,10.0,10.0,0.0,1,0,0,0,0,0,0,1,1,1,0,0,0,0,0,1,0,0,0,1,5,5,0
"The Centre for Humanitarian Datahttps://centre.humdata.org 'the Center', together with key partners, is publishing a series of eight","The Centre for Humanitarian Data ('the Center'), together with key partners, is publishing a series of eight",guidance notes on Data Responsibility in Humanitarian Action over the course of 2019 and 2020. The Guidance,guidance notes on Data Responsibility in Humanitarian Action over the course of 2019 and 2020. The Guidance,-0.03,0.0,1,0,1,10.0,10.0,0.0,1,0,0,0,0,0,0,1,1,1,0,1,0,0,0,1,0,0,0,1,5,5,1
guidance notes on Data Responsibility in Humanitarian Action over the course of 2019 and 2020. The Guidance,guidance notes on Data Responsibility in Humanitarian Action over the course of 2019 and 2020. The Guidance,"the series, the Centre aims to provide additional guidance on specific issues, processes and tools for data","the series, the Centre aims to provide additional guidance on specific issues, processes and tools for data",0.63,0.0,1,1,1,10.0,10.0,0.0,1,0,0,0,0,0,0,1,1,1,0,1,0,0,0,1,0,0,0,1,5,5,1
"the series, the Centre aims to provide additional guidance on specific issues, processes and tools for data","the series, the Centre aims to provide additional guidance on specific issues, processes and tools for data",responsibility in practice. This series is made possible with the generous support of the Directorate-General for,responsibility in practice. This series is made possible with the generous support of the Directorate-General for,-0.03,0.0,1,1,1,10.0,10.0,0.0,1,0,0,0,0,0,0,1,1,1,0,1,0,0,0,1,0,0,0,1,5,5,1
responsibility in practice. This series is made possible with the generous support of the Directorate-General for,responsibility in practice. This series is made possible with the generous support of the Directorate-General for,European Civil Protection and Humanitarian Aid Operations DG ECHO.,European Civil Protection and Humanitarian Aid Operations (DG ECHO).,-0.03,0.0,1,1,0,10.0,10.0,0.0,1,0,0,0,0,0,0,1,1,1,0,0,0,0,0,1,0,0,0,1,5,5,1
European Civil Protection and Humanitarian Aid Operations DG ECHO.,European Civil Protection and Humanitarian Aid Operations (DG ECHO).,This document covers humanitarian aid activities implemented with the financial assistance of the,This document covers humanitarian aid activities implemented with the financial assistance of the,1.33,80.26,0,0,1,10.0,9.0,-1.0,1,0,0,0,0,0,0,1,1,1,1,0,0,0,0,1,0,0,0,1,5,5,0
This document covers humanitarian aid activities implemented with the financial assistance of the,This document covers humanitarian aid activities implemented with the financial assistance of the,"European Union. The views expressed herein should not be taken, in any way, to reflect the official opinion","European Union. The views expressed herein should not be taken, in any way, to reflect the official opinion",-0.03,0.0,1,1,1,9.0,9.0,0.0,1,0,0,0,0,0,0,1,1,1,0,0,0,0,0,1,0,0,0,1,5,5,1
"European Union. The views expressed herein should not be taken, in any way, to reflect the official opinion","European Union. The views expressed herein should not be taken, in any way, to reflect the official opinion","of the European Union, and the European Commission is not responsible for any use that may be made of","of the European Union, and the European Commission is not responsible for any use that may be made of",-0.03,0.0,1,1,1,9.0,9.0,0.0,1,0,0,0,0,0,0,1,1,1,0,1,0,0,0,1,0,0,0,1,5,5,1
"of the European Union, and the European Commission is not responsible for any use that may be made of","of the European Union, and the European Commission is not responsible for any use that may be made of",the information it contains.,the information it contains.,-0.03,0.0,1,1,0,9.0,9.0,0.0,1,0,0,0,0,0,0,1,1,1,0,1,0,0,0,1,0,0,0,1,5,5,1
the information it contains.,the information it contains.,This project is co-funded,This project is co-funded,0.88,-91.54,0,0,0,9.0,7.65,-1.35,1,0,0,0,0,0,0,1,1,1,1,0,0,0,0,1,0,0,0,1,5,5,0
This project is co-funded,This project is co-funded,by the European Union,by the European Union,-0.03,0.0,1,0,0,7.65,7.65,0.0,1,0,0,0,0,0,0,1,1,1,0,1,0,0,0,1,0,0,0,1,5,5,1
by the European Union,by the European Union,THE CENTRE FOR HUMANITARIAN DATAhttps://centre.humdata.org/ DECEMBER 2020 5,THE CENTRE FOR HUMANITARIAN DATA,1.66,-0.5,1,0,0,7.65,8.0,0.35,1,0,0,0,0,0,0,1,1,1,0,0,0,0,0,1,0,0,0,1,5,5,1
