text,bbox,page_number,avg_font_size,word_count,is_all_caps,char_density,ratio_of_verbs,ratio_capitalized,ends_with_colon,is_bold,normalized_vertical_gap,indentation_change,same_alignment,is_centered_A,font_size_diff,same_font,is_bold_A,is_italic_A,is_monospace_A,same_bold,same_italic,same_monospace,line_a_ends_punctuation,line_b_starts_lowercase,is_linea_in_rectangle,is_lineb_in_rectangle,both_in_table,neither_in_table,is_linea_hashed,is_lineb_hashed,both_hashed,neither_hashed,title_label
Peer Review Framework for Predictive Analytics in Humanitarian Response,"[0, 0, 100, 20]",1,18.0,9,0,0.0315,0.0,0.7777777777777778,0,0,0.0,0.0,1,1,0.0,1,0,0,0,1,1,1,0,0,0,0,0,1,0,0,0,1,
MODEL REPORT:,"[0, 0, 100, 20]",1,26.0,2,1,0.006,0.0,1.0,1,0,0.0,0.0,1,1,0.0,1,0,0,0,1,1,1,1,0,0,0,0,1,0,0,0,1,
Drought Anticipatory Action Trigger in Niger,"[0, 0, 100, 20]",1,28.0,6,0,0.0195,0.0,0.8333333333333334,0,0,0.0,0.0,1,1,0.0,1,0,0,0,1,1,1,0,0,0,0,0,1,0,0,0,1,
"Anticipatory Action Working Group, Niger","[0, 0, 100, 20]",1,16.0,5,0,0.018,0.0,1.0,0,0,0.0,0.0,1,1,0.0,1,0,0,0,1,1,1,0,0,0,0,0,1,0,0,0,1,
January 2023,"[0, 0, 100, 20]",1,18.0,2,0,0.0055,0.0,0.5,0,0,0.0,0.0,1,1,0.0,1,0,0,0,1,1,1,0,0,0,0,0,1,0,0,0,1,
Model Report: Anticipatory Action Trigger for Drought in Niger,"[0, 0, 100, 20]",2,16.0,9,0,0.027,0.0,0.7777777777777778,0,0,0.0,0.0,1,1,0.0,1,0,0,0,1,1,1,0,0,0,0,0,1,0,0,0,1,
1. Background,"[0, 0, 100, 20]",2,12.0,2,0,0.006,0.0,0.5,0,0,0.0,0.0,1,1,0.0,1,0,0,0,1,1,1,0,0,0,0,0,1,0,0,0,1,
This document summarizes the documentation and findings developed in the peer review of the,"[0, 0, 100, 20]",2,11.0,14,0,0.039,0.14285714285714285,0.07142857142857142,0,0,0.0,0.0,1,1,0.0,1,0,0,0,1,1,1,0,0,0,0,0,1,0,0,0,1,
Anticipatory Action Trigger for Drought in Niger. The trigger mechanism was designed for an,"[0, 0, 100, 20]",2,11.0,14,0,0.039,0.14285714285714285,0.42857142857142855,0,0,0.0,0.0,1,1,0.0,1,0,0,0,1,1,1,0,0,0,0,0,1,0,0,0,1,
anticipatory action framework coordinated by OCHA. The goal of the trigger mechanism is to,"[0, 0, 100, 20]",2,11.0,14,0,0.0385,0.14285714285714285,0.14285714285714285,0,0,0.0,0.0,1,1,0.0,1,0,0,0,1,1,1,0,0,0,0,0,1,0,0,0,1,
detect increased drought risk in Niger and trigger the release of funds from the Central,"[0, 0, 100, 20]",2,11.0,15,0,0.037,0.13333333333333333,0.13333333333333333,0,0,0.0,0.0,1,1,0.0,1,0,0,0,1,1,1,0,0,0,0,0,1,0,0,0,1,
Emergency Response Fund in anticipation of drought-related humanitarian needs. The release,"[0, 0, 100, 20]",2,11.0,11,0,0.04,0.0,0.3333333333333333,0,0,0.0,0.0,1,1,0.0,1,0,0,0,1,1,1,0,0,0,0,0,1,0,0,0,1,
of funds can be triggered from six months ahead of the rainy season which runs from July,"[0, 0, 100, 20]",2,11.0,17,0,0.036,0.17647058823529413,0.058823529411764705,0,0,0.0,0.0,1,1,0.0,1,0,0,0,1,1,1,0,0,0,0,0,1,0,0,0,1,
through September until one month into the season. The trigger mechanism includes a,"[0, 0, 100, 20]",2,11.0,13,0,0.0355,0.07692307692307693,0.15384615384615385,0,0,0.0,0.0,1,1,0.0,1,0,0,0,1,1,1,0,0,0,0,0,1,0,0,0,1,
predictive model that uses seasonal precipitation forecasts and an observational model that,"[0, 0, 100, 20]",2,11.0,12,0,0.04,0.08333333333333333,0.0,0,0,0.0,0.0,1,1,0.0,1,0,0,0,1,1,1,0,0,0,0,0,1,0,0,0,1,
uses the Standardized Precipitation Index.,"[0, 0, 100, 20]",2,11.0,5,0,0.019,0.2,0.6,0,0,0.0,0.0,1,1,0.0,1,0,0,0,1,1,1,1,0,0,0,0,1,0,0,0,1,
The review was conducted between May 2022 and January 2023.,"[0, 0, 100, 20]",2,11.0,10,0,0.025,0.2,0.3,0,0,0.0,0.0,1,1,0.0,1,0,0,0,1,1,1,1,0,0,0,0,1,0,0,0,1,
2. Main Findings and Recommendations,"[0, 0, 100, 20]",2,12.0,5,0,0.016,0.0,0.6,0,0,0.0,0.0,1,1,0.0,1,0,0,0,1,1,1,0,0,0,0,0,1,0,0,0,1,
"The documentation describing the model and its application, as well as the outcomes of the","[0, 0, 100, 20]",2,11.0,15,0,0.038,0.06666666666666667,0.06666666666666667,0,0,0.0,0.0,1,1,0.0,1,0,0,0,1,1,1,0,0,0,0,0,1,0,0,0,1,
"review process, are available through the following links:","[0, 0, 100, 20]",2,11.0,8,0,0.0255,0.125,0.0,1,0,0.0,0.0,1,1,0.0,1,0,0,0,1,1,1,1,0,0,0,0,1,0,0,0,1,
The Model Cardhttps://drive.google.com/file/d/1Dim0c86H2R1Qtj6IkDxY9eWy1SVKJ77c/view?usp=sharing describes version 1 of the trigger mechanism. It was completed by,"[0, 0, 100, 20]",2,11.0,14,0,0.0745,0.125,0.17391304347826086,0,0,0.0,0.0,1,1,0.0,1,0,0,0,1,1,1,0,0,0,0,0,1,0,0,0,1,
OCHA in June 2022 and updated in October 2022.,"[0, 0, 100, 20]",2,11.0,9,0,0.019,0.1111111111111111,0.3333333333333333,0,0,0.0,0.0,1,1,0.0,1,0,0,0,1,1,1,1,0,0,0,0,1,0,0,0,1,
"completed by Mohammad Shamsudduha, Associate Professor in Humanitarian Science","[0, 0, 100, 20]",2,11.0,9,0,0.035,0.1111111111111111,0.6666666666666666,0,0,0.0,0.0,1,1,0.0,1,0,0,0,1,1,1,0,0,0,0,0,1,0,0,0,1,
"at the Institute for Risk and Disaster Reduction, University College London, in December","[0, 0, 100, 20]",2,11.0,13,0,0.038,0.0,0.6153846153846154,0,0,0.0,0.0,1,1,0.0,1,0,0,0,1,1,1,0,0,0,0,0,1,0,0,0,1,
2022.,"[0, 0, 100, 20]",2,11.0,1,0,0.0025,0.0,0.0,0,0,0.0,0.0,1,1,0.0,1,0,0,0,1,1,1,1,0,0,0,0,1,0,0,0,1,
The Implementation Plan summarizes the concrete actions that the trigger mechanismhttps://drive.google.com/file/d/1lf7VdtqXT5LWgWDnu-duYlNjh4qXMQU/view?usp=sharing,"[0, 0, 100, 20]",2,11.0,11,0,0.0765,0.07692307692307693,0.14285714285714285,0,0,0.0,0.0,1,1,0.0,1,0,0,0,1,1,1,0,0,0,0,0,1,0,0,0,1,
will inform and was developed by OCHA in October 2022.,"[0, 0, 100, 20]",2,11.0,10,0,0.0225,0.3,0.2,0,0,0.0,0.0,1,1,0.0,1,0,0,0,1,1,1,1,0,0,0,0,1,0,0,0,1,
The Ethical Matrixhttps://docs.google.com/spreadsheets/d/1RrIPpodeqIRHm9MmBv6FB0zIGP3V5r5QFwd7wF-rl8/edit?usp=sharing identifies issues that may come up in the implementation of the,"[0, 0, 100, 20]",2,11.0,14,0,0.084,0.0625,0.125,0,0,0.0,0.0,1,1,0.0,1,0,0,0,1,1,1,0,0,0,0,0,1,0,0,0,1,
trigger mechanism and stakeholders that may be impacted by those issues. The Ethical,"[0, 0, 100, 20]",2,11.0,13,0,0.036,0.15384615384615385,0.15384615384615385,0,0,0.0,0.0,1,1,0.0,1,0,0,0,1,1,1,0,0,0,0,0,1,0,0,0,1,
"Matrix was completed in January 2023 by Andrea Romaoli Garcia, ITU Topic Driver on","[0, 0, 100, 20]",2,11.0,14,0,0.0345,0.14285714285714285,0.5714285714285714,0,0,0.0,0.0,1,1,0.0,1,0,0,0,1,1,1,0,0,0,0,0,1,0,0,0,1,
Open Code.,"[0, 0, 100, 20]",2,11.0,2,0,0.0045,0.0,1.0,0,0,0.0,0.0,1,1,0.0,1,0,0,0,1,1,1,1,0,0,0,0,1,0,0,0,1,
The sections below provide a summary of the main findings and recommendations developed in,"[0, 0, 100, 20]",2,11.0,14,0,0.0385,0.14285714285714285,0.07142857142857142,0,0,0.0,0.0,1,1,0.0,1,0,0,0,1,1,1,0,0,0,0,0,1,0,0,0,1,
the review.,"[0, 0, 100, 20]",2,11.0,2,0,0.005,0.0,0.0,0,0,0.0,0.0,1,1,0.0,1,0,0,0,1,1,1,1,0,0,0,0,1,0,0,0,1,
2.1 Technical Review,"[0, 0, 100, 20]",3,12.0,3,0,0.009,0.0,0.5,0,0,0.0,0.0,1,1,0.0,1,0,0,0,1,1,1,0,0,0,0,0,1,0,0,0,1,
Intended Use,"[0, 0, 100, 20]",3,12.0,2,0,0.0055,0.5,1.0,0,0,0.0,0.0,1,1,0.0,1,0,0,0,1,1,1,0,0,0,0,0,1,0,0,0,1,
The intended use of the predictive model is appropriate.,"[0, 0, 100, 20]",3,11.0,9,0,0.024,0.2222222222222222,0.1111111111111111,0,0,0.0,0.0,1,1,0.0,1,0,0,0,1,1,1,1,0,0,0,0,1,0,0,0,1,
"The model may not detect localized rainfall shortages, which could lead to the model","[0, 0, 100, 20]",3,11.0,14,0,0.0355,0.21428571428571427,0.07142857142857142,0,0,0.0,0.0,1,1,0.0,1,0,0,0,1,1,1,0,0,0,0,0,1,0,0,0,1,
"missing a trigger where it should detect increased drought risk. In addition, crop failure","[0, 0, 100, 20]",3,11.0,14,0,0.0385,0.21428571428571427,0.07142857142857142,0,0,0.0,0.0,1,1,0.0,1,0,0,0,1,1,1,0,0,0,0,0,1,0,0,0,1,
"depends on a number of factors other than rainfall, including the use and availability of","[0, 0, 100, 20]",3,11.0,15,0,0.0375,0.06666666666666667,0.0,0,0,0.0,0.0,1,1,0.0,1,0,0,0,1,1,1,0,0,0,0,0,1,0,0,0,1,
groundwater for irrigation as well as changes in temperature. The fact that these,"[0, 0, 100, 20]",3,11.0,13,0,0.0345,0.0,0.07692307692307693,0,0,0.0,0.0,1,1,0.0,1,0,0,0,1,1,1,0,0,0,0,0,1,0,0,0,1,
additional factors are not included in the model should be considered in the,"[0, 0, 100, 20]",3,11.0,13,0,0.032,0.3076923076923077,0.0,0,0,0.0,0.0,1,1,0.0,1,0,0,0,1,1,1,0,0,0,0,0,1,0,0,0,1,
interpretation of model outputs.,"[0, 0, 100, 20]",3,11.0,4,0,0.0145,0.0,0.0,0,0,0.0,0.0,1,1,0.0,1,0,0,0,1,1,1,1,0,0,0,0,1,0,0,0,1,
Model Development and Documentation,"[0, 0, 100, 20]",3,12.0,4,0,0.016,0.0,0.75,0,0,0.0,0.0,1,1,0.0,1,0,0,0,1,1,1,0,0,0,0,0,1,0,0,0,1,
The resolution of the spatial coverage of the predictive model is very high at 0.05,"[0, 0, 100, 20]",3,11.0,15,0,0.0345,0.06666666666666667,0.0625,0,0,0.0,0.0,1,1,0.0,1,0,0,0,1,1,1,0,0,0,0,0,1,0,0,0,1,
degrees. The predictive model produces outputs on a monthly basis. The geographic,"[0, 0, 100, 20]",3,11.0,12,0,0.035,0.08333333333333333,0.16666666666666666,0,0,0.0,0.0,1,1,0.0,1,0,0,0,1,1,1,0,0,0,0,0,1,0,0,0,1,
scope of the predictive model includes the entire country of Niger. These parameters are,"[0, 0, 100, 20]",3,11.0,14,0,0.0375,0.14285714285714285,0.14285714285714285,0,0,0.0,0.0,1,1,0.0,1,0,0,0,1,1,1,0,0,0,0,0,1,0,0,0,1,
appropriate for a national-scale model.,"[0, 0, 100, 20]",3,11.0,5,0,0.0175,0.0,0.0,0,0,0.0,0.0,1,1,0.0,1,0,0,0,1,1,1,1,0,0,0,0,1,0,0,0,1,
The spatial resolution of the predictive model at 0.05 degrees is too high given that the,"[0, 0, 100, 20]",3,11.0,16,0,0.037,0.125,0.058823529411764705,0,0,0.0,0.0,1,1,0.0,1,0,0,0,1,1,1,0,0,0,0,0,1,0,0,0,1,
predictive model is primarily dependent on precipitation variability. Correlation between,"[0, 0, 100, 20]",3,11.0,10,0,0.04,0.1,0.1,0,0,0.0,0.0,1,1,0.0,1,0,0,0,1,1,1,0,0,0,0,0,1,0,0,0,1,
forecasts and observational rainfall data produced by CHIRPS is weak in Maradi and,"[0, 0, 100, 20]",3,11.0,13,0,0.035,0.15384615384615385,0.15384615384615385,0,0,0.0,0.0,1,1,0.0,1,0,0,0,1,1,1,0,0,0,0,0,1,0,0,0,1,
"Niamey regions, where the irrigation is the highest in the country.","[0, 0, 100, 20]",3,11.0,11,0,0.0285,0.09090909090909091,0.09090909090909091,0,0,0.0,0.0,1,1,0.0,1,0,0,0,1,1,1,1,0,0,0,0,1,0,0,0,1,
Model Evaluation,"[0, 0, 100, 20]",3,12.0,2,0,0.0075,0.0,1.0,0,0,0.0,0.0,1,1,0.0,1,0,0,0,1,1,1,0,0,0,0,0,1,0,0,0,1,
"The predictive model is evaluated using accuracy, hit rate, miss rate, false positives and","[0, 0, 100, 20]",3,11.0,14,0,0.0385,0.21428571428571427,0.07142857142857142,0,0,0.0,0.0,1,1,0.0,1,0,0,0,1,1,1,0,0,0,0,0,1,0,0,0,1,
false negatives as parameters. These model evaluation criteria are appropriate for this,"[0, 0, 100, 20]",3,11.0,12,0,0.038,0.08333333333333333,0.08333333333333333,0,0,0.0,0.0,1,1,0.0,1,0,0,0,1,1,1,0,0,0,0,0,1,0,0,0,1,
predictive model.,"[0, 0, 100, 20]",3,11.0,2,0,0.008,0.0,0.0,0,0,0.0,0.0,1,1,0.0,1,0,0,0,1,1,1,1,0,0,0,0,1,0,0,0,1,
A comparison between the predictive model outputs and NextGen forecasts was based,"[0, 0, 100, 20]",3,11.0,12,0,0.035,0.16666666666666666,0.16666666666666666,0,0,0.0,0.0,1,1,0.0,1,0,0,0,1,1,1,0,0,0,0,0,1,0,0,0,1,
only on CHIRPS gridded rainfall data. No detailed information is provided on the,"[0, 0, 100, 20]",3,11.0,13,0,0.034,0.23076923076923078,0.15384615384615385,0,0,0.0,0.0,1,1,0.0,1,0,0,0,1,1,1,0,0,0,0,0,1,0,0,0,1,
downscaling of the forecasts and evaluation of the downscaled technique.,"[0, 0, 100, 20]",3,11.0,10,0,0.0315,0.0,0.0,0,0,0.0,0.0,1,1,0.0,1,0,0,0,1,1,1,1,0,0,0,0,1,0,0,0,1,
Operational Readiness,"[0, 0, 100, 20]",3,12.0,2,0,0.01,0.0,1.0,0,0,0.0,0.0,1,1,0.0,1,0,0,0,1,1,1,0,0,0,0,0,1,0,0,0,1,
Activities and funding are provided on a “no-regrets” basis after a trigger activation.,"[0, 0, 100, 20]",3,11.0,13,0,0.0375,0.13333333333333333,0.07142857142857142,0,0,0.0,0.0,1,1,0.0,1,0,0,0,1,1,1,1,0,0,0,0,1,0,0,0,1,
Activities and funding are purposefully selected to still be valuable in the absence of a,"[0, 0, 100, 20]",3,11.0,15,0,0.0375,0.2,0.06666666666666667,0,0,0.0,0.0,1,1,0.0,1,0,0,0,1,1,1,0,0,0,0,0,1,0,0,0,1,
shock. The addition of an observational trigger based on SPI is a strength of this,"[0, 0, 100, 20]",3,11.0,15,0,0.034,0.13333333333333333,0.13333333333333333,0,0,0.0,0.0,1,1,0.0,1,0,0,0,1,1,1,0,0,0,0,0,1,0,0,0,1,
anticipatory trigger mechanism.,"[0, 0, 100, 20]",3,11.0,3,0,0.0145,0.0,0.0,0,0,0.0,0.0,1,1,0.0,1,0,0,0,1,1,1,1,0,0,0,0,1,0,0,0,1,
The forecast accuracy could be improved if the predictive model is tailored to individual,"[0, 0, 100, 20]",3,11.0,14,0,0.038,0.35714285714285715,0.07142857142857142,0,0,0.0,0.0,1,1,0.0,1,0,0,0,1,1,1,0,0,0,0,0,1,0,0,0,1,
areas within Niger.,"[0, 0, 100, 20]",3,11.0,3,0,0.0085,0.0,0.3333333333333333,0,0,0.0,0.0,1,1,0.0,1,0,0,0,1,1,1,1,0,0,0,0,1,0,0,0,1,
There is little mention of local/national capacity building or strengthening in the process.,"[0, 0, 100, 20]",3,11.0,13,0,0.04,0.07692307692307693,0.07142857142857142,0,0,0.0,0.0,1,1,0.0,1,0,0,0,1,1,1,1,0,0,0,0,1,0,0,0,1,
The performance of the predictive model should be evaluated against the observational,"[0, 0, 100, 20]",3,11.0,12,0,0.037,0.16666666666666666,0.08333333333333333,0,0,0.0,0.0,1,1,0.0,1,0,0,0,1,1,1,0,0,0,0,0,1,0,0,0,1,
model outputs to better understand the weaknesses in the predictive model.,"[0, 0, 100, 20]",3,11.0,11,0,0.032,0.09090909090909091,0.0,0,0,0.0,0.0,1,1,0.0,1,0,0,0,1,1,1,1,0,0,0,0,1,0,0,0,1,
Strengthening the predictive model outputs increases the potential impact of the trigger,"[0, 0, 100, 20]",3,11.0,12,0,0.0385,0.25,0.08333333333333333,0,0,0.0,0.0,1,1,0.0,1,0,0,0,1,1,1,0,0,0,0,0,1,0,0,0,1,
mechanism due to the increased lead time.,"[0, 0, 100, 20]",3,11.0,7,0,0.0175,0.14285714285714285,0.0,0,0,0.0,0.0,1,1,0.0,1,0,0,0,1,1,1,1,0,0,0,0,1,0,0,0,1,
The low or even negative correlation between the predictive model outputs and CHIRPS,"[0, 0, 100, 20]",4,11.0,13,0,0.036,0.0,0.15384615384615385,0,0,0.0,0.0,1,1,0.0,1,0,0,0,1,1,1,0,0,0,0,0,1,0,0,0,1,
precipitation in the northern part of Niger should be examined to improve the,"[0, 0, 100, 20]",4,11.0,13,0,0.0325,0.23076923076923078,0.07692307692307693,0,0,0.0,0.0,1,1,0.0,1,0,0,0,1,1,1,0,0,0,0,0,1,0,0,0,1,
performance and validity of the predictive model.,"[0, 0, 100, 20]",4,11.0,7,0,0.0215,0.0,0.0,0,0,0.0,0.0,1,1,0.0,1,0,0,0,1,1,1,1,0,0,0,0,1,0,0,0,1,
2.2 Ethical Review,"[0, 0, 100, 20]",4,12.0,3,0,0.008,0.0,0.5,0,0,0.0,0.0,1,1,0.0,1,0,0,0,1,1,1,0,0,0,0,0,1,0,0,0,1,
False negative activation non-activation in the presence of a shock,"[0, 0, 100, 20]",4,12.0,10,0,0.029,0.0,0.09090909090909091,0,0,0.0,0.0,1,1,0.0,1,0,0,0,1,1,1,0,0,0,0,0,1,0,0,0,1,
A false negative would deprive the community of timely aid.,"[0, 0, 100, 20]",4,11.0,10,0,0.025,0.1,0.1,0,0,0.0,0.0,1,1,0.0,1,0,0,0,1,1,1,1,0,0,0,0,1,0,0,0,1,
Recommendation: The outputs of the predictive model should be continuously evaluated,"[0, 0, 100, 20]",4,11.0,11,0,0.037,0.18181818181818182,0.18181818181818182,0,0,0.0,0.0,1,1,0.0,1,0,0,0,1,1,1,0,0,0,0,0,1,0,0,0,1,
against the outputs of the observational model and against CHIRPS precipitation data to,"[0, 0, 100, 20]",4,11.0,13,0,0.0375,0.0,0.07692307692307693,0,0,0.0,0.0,1,1,0.0,1,0,0,0,1,1,1,0,0,0,0,0,1,0,0,0,1,
lower the likelihood of false negatives.,"[0, 0, 100, 20]",4,11.0,6,0,0.0175,0.0,0.0,0,0,0.0,0.0,1,1,0.0,1,0,0,0,1,1,1,1,0,0,0,0,1,0,0,0,1,
False positive activation activation in the absence of a shock,"[0, 0, 100, 20]",4,12.0,10,0,0.0265,0.0,0.1,0,0,0.0,0.0,1,1,0.0,1,0,0,0,1,1,1,0,0,0,0,0,1,0,0,0,1,
A false positive would increase the risk of wasted financial resources. Such error could,"[0, 0, 100, 20]",4,11.0,14,0,0.0375,0.07142857142857142,0.14285714285714285,0,0,0.0,0.0,1,1,0.0,1,0,0,0,1,1,1,0,0,0,0,0,1,0,0,0,1,
undermine the confidence of stakeholders and donors and could lead to discontinuation,"[0, 0, 100, 20]",4,11.0,12,0,0.037,0.16666666666666666,0.0,0,0,0.0,0.0,1,1,0.0,1,0,0,0,1,1,1,0,0,0,0,0,1,0,0,0,1,
"of the trigger mechanism. A false negative primarily impacts other stakeholders,","[0, 0, 100, 20]",4,11.0,11,0,0.035,0.09090909090909091,0.09090909090909091,0,0,0.0,0.0,1,1,0.0,1,0,0,0,1,1,1,1,0,0,0,0,1,0,0,0,1,
"including local NGOs, the model developers and UN entities, due to the misallocation of","[0, 0, 100, 20]",4,11.0,14,0,0.037,0.07142857142857142,0.14285714285714285,0,0,0.0,0.0,1,1,0.0,1,0,0,0,1,1,1,0,0,0,0,0,1,0,0,0,1,
resources. It also undermines trust in the trigger mechanism.,"[0, 0, 100, 20]",4,11.0,9,0,0.0265,0.1111111111111111,0.1111111111111111,0,0,0.0,0.0,1,1,0.0,1,0,0,0,1,1,1,1,0,0,0,0,1,0,0,0,1,
"Recommendation: A false positive is more tolerable compared to a false negative, as a","[0, 0, 100, 20]",4,11.0,14,0,0.036,0.14285714285714285,0.14285714285714285,0,0,0.0,0.0,1,1,0.0,1,0,0,0,1,1,1,0,0,0,0,0,1,0,0,0,1,
false positive triggers activities and funding that benefit the population even in the,"[0, 0, 100, 20]",4,11.0,13,0,0.037,0.07692307692307693,0.0,0,0,0.0,0.0,1,1,0.0,1,0,0,0,1,1,1,0,0,0,0,0,1,0,0,0,1,
absence of a shock. The outputs of the predictive model should be continuously,"[0, 0, 100, 20]",4,11.0,13,0,0.033,0.07692307692307693,0.07692307692307693,0,0,0.0,0.0,1,1,0.0,1,0,0,0,1,1,1,0,0,0,0,0,1,0,0,0,1,
evaluated against the outputs of the observational model and against CHIRPS,"[0, 0, 100, 20]",4,11.0,11,0,0.0325,0.09090909090909091,0.09090909090909091,0,0,0.0,0.0,1,1,0.0,1,0,0,0,1,1,1,0,0,0,0,0,1,0,0,0,1,
precipitation data to lower the likelihood of false positives.,"[0, 0, 100, 20]",4,11.0,9,0,0.027,0.1111111111111111,0.0,0,0,0.0,0.0,1,1,0.0,1,0,0,0,1,1,1,1,0,0,0,0,1,0,0,0,1,
Identity exposure exposure of individual identities through potential use of additional data,"[0, 0, 100, 20]",4,12.0,12,0,0.0405,0.0,0.08333333333333333,0,0,0.0,0.0,1,1,0.0,1,0,0,0,1,1,1,0,0,0,0,0,1,0,0,0,1,
sources in implementation of the model,"[0, 0, 100, 20]",4,11.0,6,0,0.0165,0.0,0.0,0,0,0.0,0.0,1,1,0.0,1,0,0,0,1,1,1,0,0,0,0,0,1,0,0,0,1,
Unauthorized access to any personal data used in future implementation of the trigger,"[0, 0, 100, 20]",4,11.0,13,0,0.0365,0.07692307692307693,0.07692307692307693,0,0,0.0,0.0,1,1,0.0,1,0,0,0,1,1,1,0,0,0,0,0,1,0,0,0,1,
mechanism could cause harm and carries reputational risk.,"[0, 0, 100, 20]",4,11.0,8,0,0.025,0.25,0.0,0,0,0.0,0.0,1,1,0.0,1,0,0,0,1,1,1,1,0,0,0,0,1,0,0,0,1,
Recommendation: Given that the trigger mechanism does not include the use of any,"[0, 0, 100, 20]",4,11.0,13,0,0.034,0.23076923076923078,0.15384615384615385,0,0,0.0,0.0,1,1,0.0,1,0,0,0,1,1,1,0,0,0,0,0,1,0,0,0,1,
personal data there is little concern that a data breach could result in re-identification. If,"[0, 0, 100, 20]",4,11.0,15,0,0.04,0.13333333333333333,0.0625,0,0,0.0,0.0,1,1,0.0,1,0,0,0,1,1,1,0,0,0,0,0,1,0,0,0,1,
the implementation of the trigger mechanism evolves over time to include additional,"[0, 0, 100, 20]",4,11.0,12,0,0.036,0.16666666666666666,0.0,0,0,0.0,0.0,1,1,0.0,1,0,0,0,1,1,1,0,0,0,0,0,1,0,0,0,1,
"personal data, the tools and infrastructure used in implementation should be","[0, 0, 100, 20]",4,11.0,11,0,0.033,0.18181818181818182,0.0,0,0,0.0,0.0,1,1,0.0,1,0,0,0,1,1,1,0,0,0,0,0,1,0,0,0,1,
re-evaluated and adjusted as needed to mitigate the risk of identity exposure.,"[0, 0, 100, 20]",4,11.0,12,0,0.0335,0.25,0.0,0,0,0.0,0.0,1,1,0.0,1,0,0,0,1,1,1,1,0,0,0,0,1,0,0,0,1,
Bias in available data,"[0, 0, 100, 20]",4,12.0,4,0,0.0095,0.0,0.25,0,0,0.0,0.0,1,1,0.0,1,0,0,0,1,1,1,0,0,0,0,0,1,0,0,0,1,
Bias in data availability resulting from gaps in data for different regions in Niger could,"[0, 0, 100, 20]",4,11.0,15,0,0.038,0.06666666666666667,0.13333333333333333,0,0,0.0,0.0,1,1,0.0,1,0,0,0,1,1,1,0,0,0,0,0,1,0,0,0,1,
affect the allocation of funding and activities.,"[0, 0, 100, 20]",4,11.0,7,0,0.021,0.14285714285714285,0.0,0,0,0.0,0.0,1,1,0.0,1,0,0,0,1,1,1,1,0,0,0,0,1,0,0,0,1,
Recommendation: Determine whether there are gaps resulting in biases in climate data,"[0, 0, 100, 20]",4,11.0,12,0,0.0365,0.16666666666666666,0.16666666666666666,0,0,0.0,0.0,1,1,0.0,1,0,0,0,1,1,1,0,0,0,0,0,1,0,0,0,1,
availability for Niger in order to prevent unfair allocation of funding and activities.,"[0, 0, 100, 20]",4,11.0,13,0,0.0375,0.07692307692307693,0.07692307692307693,0,0,0.0,0.0,1,1,0.0,1,0,0,0,1,1,1,1,0,0,0,0,1,0,0,0,1,
Feedback,"[0, 0, 100, 20]",5,12.0,1,0,0.004,0.0,1.0,0,0,0.0,0.0,1,1,0.0,1,0,0,0,1,1,1,0,0,0,0,0,1,0,0,0,1,
"The Centre invites individuals and organizations working in the humanitarian, academic, research and","[0, 0, 100, 20]",5,11.0,13,0,0.044,0.15384615384615385,0.15384615384615385,0,0,0.0,0.0,1,1,0.0,1,0,0,0,1,1,1,0,0,0,0,0,1,0,0,0,1,
private sector to engage with us on the peer review process. Please send feedback on the Peer Review,"[0, 0, 100, 20]",5,11.0,18,0,0.0415,0.1111111111111111,0.16666666666666666,0,0,0.0,0.0,1,1,0.0,1,0,0,0,1,1,1,0,0,0,0,0,1,0,0,0,1,
Framework to centrehumdata@un.org.mailto:centrehumdata@un.org,"[0, 0, 100, 20]",5,11.0,3,0,0.0295,0.16666666666666666,0.1111111111111111,0,0,0.0,0.0,1,1,0.0,1,0,0,0,1,1,1,0,0,0,0,0,1,0,0,0,1,
