text,bbox,page_number,avg_font_size,word_count,is_all_caps,char_density,ratio_of_verbs,ratio_capitalized,ends_with_colon,is_bold,normalized_vertical_gap,indentation_change,same_alignment,is_centered_A,font_size_diff,same_font,is_bold_A,is_italic_A,is_monospace_A,same_bold,same_italic,same_monospace,line_a_ends_punctuation,line_b_starts_lowercase,is_linea_in_rectangle,is_lineb_in_rectangle,both_in_table,neither_in_table,is_linea_hashed,is_lineb_hashed,both_hashed,neither_hashed,title_label
The Ultimate PDF Sharing Checklist,"[0, 0, 100, 20]",1,13.5,5,0,0.015,0.0,1.0,0,0,0.0,0.0,1,1,0.0,1,0,0,0,1,1,1,0,0,0,0,0,1,0,0,0,1,
Sharing PDFs can be a breeze with Adobe Acrobat. Whether you're,"[0, 0, 100, 20]",1,13.5,11,0,0.0265,0.25,0.4166666666666667,0,0,0.0,0.0,1,1,0.0,1,0,0,0,1,1,1,0,0,0,0,0,1,0,0,0,1,
"collaborating on a project, seeking feedback, or simply distributing","[0, 0, 100, 20]",1,13.5,9,0,0.03,0.3333333333333333,0.0,0,0,0.0,0.0,1,1,0.0,1,0,0,0,1,1,1,0,0,0,0,0,1,0,0,0,1,
"information, this checklist will ensure you cover all the bases. Let's dive","[0, 0, 100, 20]",1,13.5,12,0,0.032,0.23076923076923078,0.07692307692307693,0,0,0.0,0.0,1,1,0.0,1,0,0,0,1,1,1,0,0,0,0,0,1,0,0,0,1,
into the essentials of sharing PDFs effectively.,"[0, 0, 100, 20]",1,13.5,7,0,0.021,0.14285714285714285,0.14285714285714285,0,0,0.0,0.0,1,1,0.0,1,0,0,0,1,1,1,1,0,0,0,0,1,0,0,0,1,
General Sharing Checklist,"[0, 0, 100, 20]",1,13.5,3,0,0.0115,0.0,1.0,0,0,0.0,0.0,1,1,0.0,1,0,0,0,1,1,1,0,0,0,0,0,1,0,0,0,1,
Open Your PDF,"[0, 0, 100, 20]",1,10.02,3,0,0.0055,0.3333333333333333,1.0,0,0,0.0,0.0,1,1,0.0,1,0,0,0,1,1,1,0,0,0,0,0,1,0,0,0,1,
Have you launched Acrobat or Acrobat Reader and opened,"[0, 0, 100, 20]",1,10.02,9,0,0.023,0.3333333333333333,0.4444444444444444,0,0,0.0,0.0,1,1,0.0,1,0,0,0,1,1,1,0,0,0,0,0,1,0,0,0,1,
the PDF you want to share?,"[0, 0, 100, 20]",1,13.5,6,0,0.0105,0.16666666666666666,0.16666666666666666,0,0,0.0,0.0,1,1,0.0,1,0,0,0,1,1,1,1,0,0,0,0,1,0,0,0,1,
Choose Your Sharing Method,"[0, 0, 100, 20]",1,10.02,4,0,0.0115,0.5,1.0,0,0,0.0,0.0,1,1,0.0,1,0,0,0,1,1,1,0,0,0,0,0,1,0,0,0,1,
"Are you sharing via email, link, or a third-party app like","[0, 0, 100, 20]",1,10.02,11,0,0.024,0.09090909090909091,0.08333333333333333,0,0,0.0,0.0,1,1,0.0,1,0,0,0,1,1,1,0,0,0,0,0,1,0,0,0,1,
Microsoft Teams or WhatsApp?,"[0, 0, 100, 20]",1,13.5,4,0,0.0125,0.0,0.75,0,0,0.0,0.0,1,1,0.0,1,0,0,0,1,1,1,1,0,0,0,0,1,0,0,0,1,
Set Permissions,"[0, 0, 100, 20]",1,10.02,2,0,0.007,0.0,1.0,0,0,0.0,0.0,1,1,0.0,1,0,0,0,1,1,1,0,0,0,0,0,1,0,0,0,1,
Have you decided if recipients can comment or just view the,"[0, 0, 100, 20]",1,10.02,11,0,0.0245,0.36363636363636365,0.09090909090909091,0,0,0.0,0.0,1,1,0.0,1,0,0,0,1,1,1,0,0,0,0,0,1,0,0,0,1,
document?,"[0, 0, 100, 20]",1,13.5,1,0,0.0045,0.0,0.0,0,0,0.0,0.0,1,1,0.0,1,0,0,0,1,1,1,1,0,0,0,0,1,0,0,0,1,
Add Recipients,"[0, 0, 100, 20]",1,10.02,2,0,0.0065,0.0,1.0,0,0,0.0,0.0,1,1,0.0,1,0,0,0,1,1,1,0,0,0,0,0,1,0,0,0,1,
Did you enter the email addresses of everyone who needs,"[0, 0, 100, 20]",1,10.02,10,0,0.023,0.2,0.1,0,0,0.0,0.0,1,1,0.0,1,0,0,0,1,1,1,0,0,0,0,0,1,0,0,0,1,
access?,"[0, 0, 100, 20]",1,13.5,1,0,0.0035,0.0,0.0,0,0,0.0,0.0,1,1,0.0,1,0,0,0,1,1,1,1,0,0,0,0,1,0,0,0,1,
Customize Your Message,"[0, 0, 100, 20]",1,10.02,3,0,0.01,0.3333333333333333,1.0,0,0,0.0,0.0,1,1,0.0,1,0,0,0,1,1,1,0,0,0,0,0,1,0,0,0,1,
Have you added a personal touch to the subject and message,"[0, 0, 100, 20]",1,10.02,11,0,0.024,0.18181818181818182,0.09090909090909091,0,0,0.0,0.0,1,1,0.0,1,0,0,0,1,1,1,0,0,0,0,0,1,0,0,0,1,
fields?,"[0, 0, 100, 20]",1,13.5,1,0,0.0035,0.0,0.0,0,0,0.0,0.0,1,1,0.0,1,0,0,0,1,1,1,1,0,0,0,0,1,0,0,0,1,
Create and Share the Link,"[0, 0, 100, 20]",1,10.02,5,0,0.0105,0.0,0.6,0,0,0.0,0.0,1,1,0.0,1,0,0,0,1,1,1,0,0,0,0,0,1,0,0,0,1,
Did you generate a shareable link and copy it for distribution?,"[0, 0, 100, 20]",1,10.02,11,0,0.0265,0.09090909090909091,0.09090909090909091,0,0,0.0,0.0,1,1,0.0,1,0,0,0,1,1,1,1,0,0,0,0,1,0,0,0,1,
Send the Invitation,"[0, 0, 100, 20]",1,10.02,3,0,0.0085,0.3333333333333333,0.6666666666666666,0,0,0.0,0.0,1,1,0.0,1,0,0,0,1,1,1,0,0,0,0,0,1,0,0,0,1,
Have you sent the email or shared the link through your,"[0, 0, 100, 20]",2,10.02,11,0,0.0225,0.2727272727272727,0.09090909090909091,0,0,0.0,0.0,1,1,0.0,1,0,0,0,1,1,1,0,0,0,0,0,1,0,0,0,1,
chosen platform?,"[0, 0, 100, 20]",2,13.5,2,0,0.0075,0.5,0.0,0,0,0.0,0.0,1,1,0.0,1,0,0,0,1,1,1,1,0,0,0,0,1,0,0,0,1,
Follow Up,"[0, 0, 100, 20]",2,10.02,2,0,0.004,0.0,1.0,0,0,0.0,0.0,1,1,0.0,1,0,0,0,1,1,1,0,0,0,0,0,1,0,0,0,1,
Are you tracking who has accessed the document and,"[0, 0, 100, 20]",2,10.02,9,0,0.021,0.3333333333333333,0.1111111111111111,0,0,0.0,0.0,1,1,0.0,1,0,0,0,1,1,1,0,0,0,0,0,1,0,0,0,1,
following up as needed?,"[0, 0, 100, 20]",2,13.5,4,0,0.01,0.5,0.0,0,0,0.0,0.0,1,1,0.0,1,0,0,0,1,1,1,1,0,0,0,0,1,0,0,0,1,
Professional Tip: Clear Instructions,"[0, 0, 100, 20]",2,13.5,4,0,0.0165,0.0,1.0,0,0,0.0,0.0,1,1,0.0,1,0,0,0,1,1,1,0,0,0,0,0,1,0,0,0,1,
Ensure your email instructions are clear and concise to avoid any,"[0, 0, 100, 20]",2,13.5,11,0,0.0275,0.2727272727272727,0.09090909090909091,0,0,0.0,0.0,1,1,0.0,1,0,0,0,1,1,1,0,0,0,0,0,1,0,0,0,1,
confusion for your recipients.,"[0, 0, 100, 20]",2,13.5,4,0,0.0135,0.0,0.0,0,0,0.0,0.0,1,1,0.0,1,0,0,0,1,1,1,1,0,0,0,0,1,0,0,0,1,
Sharing Checklist for Real Estate Professionals,"[0, 0, 100, 20]",2,13.5,6,0,0.021,0.16666666666666666,0.8333333333333334,0,0,0.0,0.0,1,1,0.0,1,0,0,0,1,1,1,0,0,0,0,0,1,0,0,0,1,
"In the real estate industry, sharing documents efficiently is crucial for","[0, 0, 100, 20]",2,13.5,11,0,0.0315,0.18181818181818182,0.09090909090909091,0,0,0.0,0.0,1,1,0.0,1,0,0,0,1,1,1,0,0,0,0,0,1,0,0,0,1,
closing deals and keeping clients informed. Here's a tailored checklist to,"[0, 0, 100, 20]",2,13.5,11,0,0.032,0.25,0.08333333333333333,0,0,0.0,0.0,1,1,0.0,1,0,0,0,1,1,1,0,0,0,0,0,1,0,0,0,1,
help you manage your PDF sharing needs.,"[0, 0, 100, 20]",2,13.5,7,0,0.0165,0.14285714285714285,0.14285714285714285,0,0,0.0,0.0,1,1,0.0,1,0,0,0,1,1,1,1,0,0,0,0,1,0,0,0,1,
Real Estate Sharing Checklist,"[0, 0, 100, 20]",2,13.5,4,0,0.013,0.0,1.0,0,0,0.0,0.0,1,1,0.0,1,0,0,0,1,1,1,0,0,0,0,0,1,0,0,0,1,
Open Your Property Document,"[0, 0, 100, 20]",2,10.02,4,0,0.012,0.25,1.0,0,0,0.0,0.0,1,1,0.0,1,0,0,0,1,1,1,0,0,0,0,0,1,0,0,0,1,
Have you launched Acrobat or Acrobat Reader and opened,"[0, 0, 100, 20]",1,10.02,9,0,0.023,0.3333333333333333,0.4444444444444444,0,0,0.0,0.0,1,1,0.0,1,0,0,0,1,1,1,0,0,0,0,0,1,0,0,0,1,
the property listing or contract you need to share?,"[0, 0, 100, 20]",2,13.5,9,0,0.0215,0.1111111111111111,0.0,0,0,0.0,0.0,1,1,0.0,1,0,0,0,1,1,1,1,0,0,0,0,1,0,0,0,1,
Choose Your Sharing Method,"[0, 0, 100, 20]",1,10.02,4,0,0.0115,0.5,1.0,0,0,0.0,0.0,1,1,0.0,1,0,0,0,1,1,1,0,0,0,0,0,1,0,0,0,1,
"Are you sharing via email, link, or a third-party app like","[0, 0, 100, 20]",1,10.02,11,0,0.024,0.09090909090909091,0.08333333333333333,0,0,0.0,0.0,1,1,0.0,1,0,0,0,1,1,1,0,0,0,0,0,1,0,0,0,1,
Microsoft Teams or WhatsApp?,"[0, 0, 100, 20]",1,13.5,4,0,0.0125,0.0,0.75,0,0,0.0,0.0,1,1,0.0,1,0,0,0,1,1,1,1,0,0,0,0,1,0,0,0,1,
Set Permissions,"[0, 0, 100, 20]",1,10.02,2,0,0.007,0.0,1.0,0,0,0.0,0.0,1,1,0.0,1,0,0,0,1,1,1,0,0,0,0,0,1,0,0,0,1,
Have you decided if clients can comment on the document or,"[0, 0, 100, 20]",2,10.02,11,0,0.024,0.2727272727272727,0.09090909090909091,0,0,0.0,0.0,1,1,0.0,1,0,0,0,1,1,1,0,0,0,0,0,1,0,0,0,1,
just view it?,"[0, 0, 100, 20]",2,13.5,3,0,0.0055,0.0,0.0,0,0,0.0,0.0,1,1,0.0,1,0,0,0,1,1,1,1,0,0,0,0,1,0,0,0,1,
Add Clients and Stakeholders,"[0, 0, 100, 20]",2,10.02,4,0,0.0125,0.0,0.75,0,0,0.0,0.0,1,1,0.0,1,0,0,0,1,1,1,0,0,0,0,0,1,0,0,0,1,
"Did you enter the email addresses of clients, agents, and other","[0, 0, 100, 20]",3,10.02,11,0,0.0265,0.09090909090909091,0.09090909090909091,0,0,0.0,0.0,1,1,0.0,1,0,0,0,1,1,1,0,0,0,0,0,1,0,0,0,1,
stakeholders?,"[0, 0, 100, 20]",3,13.5,1,0,0.0065,0.0,0.0,0,0,0.0,0.0,1,1,0.0,1,0,0,0,1,1,1,1,0,0,0,0,1,0,0,0,1,
Customize Your Message,"[0, 0, 100, 20]",1,10.02,3,0,0.01,0.3333333333333333,1.0,0,0,0.0,0.0,1,1,0.0,1,0,0,0,1,1,1,0,0,0,0,0,1,0,0,0,1,
Have you added a personal touch to the subject and message,"[0, 0, 100, 20]",1,10.02,11,0,0.024,0.18181818181818182,0.09090909090909091,0,0,0.0,0.0,1,1,0.0,1,0,0,0,1,1,1,0,0,0,0,0,1,0,0,0,1,
"fields, highlighting key property details?","[0, 0, 100, 20]",3,13.5,5,0,0.019,0.2,0.0,0,0,0.0,0.0,1,1,0.0,1,0,0,0,1,1,1,1,0,0,0,0,1,0,0,0,1,
Create and Share the Link,"[0, 0, 100, 20]",1,10.02,5,0,0.0105,0.0,0.6,0,0,0.0,0.0,1,1,0.0,1,0,0,0,1,1,1,0,0,0,0,0,1,0,0,0,1,
Did you generate a shareable link and copy it for distribution?,"[0, 0, 100, 20]",1,10.02,11,0,0.0265,0.09090909090909091,0.09090909090909091,0,0,0.0,0.0,1,1,0.0,1,0,0,0,1,1,1,1,0,0,0,0,1,0,0,0,1,
Send the Invitation,"[0, 0, 100, 20]",1,10.02,3,0,0.0085,0.3333333333333333,0.6666666666666666,0,0,0.0,0.0,1,1,0.0,1,0,0,0,1,1,1,0,0,0,0,0,1,0,0,0,1,
Have you sent the email or shared the link through your,"[0, 0, 100, 20]",2,10.02,11,0,0.0225,0.2727272727272727,0.09090909090909091,0,0,0.0,0.0,1,1,0.0,1,0,0,0,1,1,1,0,0,0,0,0,1,0,0,0,1,
chosen platform?,"[0, 0, 100, 20]",2,13.5,2,0,0.0075,0.5,0.0,0,0,0.0,0.0,1,1,0.0,1,0,0,0,1,1,1,1,0,0,0,0,1,0,0,0,1,
Follow Up,"[0, 0, 100, 20]",2,10.02,2,0,0.004,0.0,1.0,0,0,0.0,0.0,1,1,0.0,1,0,0,0,1,1,1,0,0,0,0,0,1,0,0,0,1,
Are you tracking who has accessed the document and,"[0, 0, 100, 20]",2,10.02,9,0,0.021,0.3333333333333333,0.1111111111111111,0,0,0.0,0.0,1,1,0.0,1,0,0,0,1,1,1,0,0,0,0,0,1,0,0,0,1,
following up with clients for feedback or next steps?,"[0, 0, 100, 20]",3,13.5,9,0,0.0225,0.1111111111111111,0.0,0,0,0.0,0.0,1,1,0.0,1,0,0,0,1,1,1,1,0,0,0,0,1,0,0,0,1,
Professional Tip: Highlight Key Details,"[0, 0, 100, 20]",3,13.5,5,0,0.0175,0.0,1.0,0,0,0.0,0.0,1,1,0.0,1,0,0,0,1,1,1,0,0,0,0,0,1,0,0,0,1,
Make sure to emphasize important property details in your message to,"[0, 0, 100, 20]",3,13.5,11,0,0.029,0.09090909090909091,0.09090909090909091,0,0,0.0,0.0,1,1,0.0,1,0,0,0,1,1,1,0,0,0,0,0,1,0,0,0,1,
capture your clients' attention.,"[0, 0, 100, 20]",3,13.5,4,0,0.0145,0.0,0.0,0,0,0.0,0.0,1,1,0.0,1,0,0,0,1,1,1,1,0,0,0,0,1,0,0,0,1,
Conclusion,"[0, 0, 100, 20]",3,13.5,1,0,0.005,0.0,1.0,0,0,0.0,0.0,1,1,0.0,1,0,0,0,1,1,1,0,0,0,0,0,1,0,0,0,1,
"Sharing PDFs with Adobe Acrobat is straightforward and efficient,","[0, 0, 100, 20]",3,13.5,9,0,0.0285,0.2222222222222222,0.4444444444444444,0,0,0.0,0.0,1,1,0.0,1,0,0,0,1,1,1,1,0,0,0,0,1,0,0,0,1,
whether you're working on a general project or managing real estate,"[0, 0, 100, 20]",3,13.5,11,0,0.0285,0.25,0.0,0,0,0.0,0.0,1,1,0.0,1,0,0,0,1,1,1,0,0,0,0,0,1,0,0,0,1,
"documents. By following these checklists, you can ensure that your","[0, 0, 100, 20]",3,13.5,10,0,0.0285,0.2,0.1,0,0,0.0,0.0,1,1,0.0,1,0,0,0,1,1,1,0,0,0,0,0,1,0,0,0,1,
sharing process is smooth and professional. Start sharing smarter today.,"[0, 0, 100, 20]",3,13.5,10,0,0.0315,0.3,0.1,0,0,0.0,0.0,1,1,0.0,1,0,0,0,1,1,1,1,0,0,0,0,1,0,0,0,1,
